title,time_published,summary,ticker_sentiment
"Stocks Edge Lower, Walmart, Microsoft, Coinbase, Alibaba In Focus - Five Things To Know",20220726T100400,Stock futures edge lower ahead of earnings parade. Walmart tumbles after surprise profit warning. Microsoft nudges higher ahead of q4 earnings. Coinbase shares slide amid reports of SEC probe and Alibaba shares leap after seeking primary Hong Kong listing ...,"[{'ticker': 'MMM', 'relevance_score': '0.053153', 'ticker_sentiment_score': '0.07869', 'ticker_sentiment_label': 'Neutral'}]"
3M Announces Plans to Create Long Term Value Through Spin-Off of Health Care Business,20220726T102900,"New 3M will remain a leading global material science innovator serving diverse end markets, with science and technology, manufacturing, global capabilities, and iconic brands","[{'ticker': 'MMM', 'relevance_score': '0.039745', 'ticker_sentiment_score': '0.176119', 'ticker_sentiment_label': 'Somewhat-Bullish'}]"
3M to spin off healthcare business,20220726T104200,"The logo of 3M is seen at the 3M Tilloy plant in Tilloy-Lez-Cambrai, France, August 18, 2019. REUTERS/Pascal Rossignol/File Photo July 26 ( Reuters ) - 3M Co ( MMM.N ) said on Tuesday the industrial giant plans to spin off its healthcare business and will retain a stake of 19.9% in the unit.","[{'ticker': 'MMM', 'relevance_score': '0.285526', 'ticker_sentiment_score': '0.0', 'ticker_sentiment_label': 'Neutral'}]"
"3M Tops Q2 Earnings Forecast, Trims 2022 Profit Outlook Amid U.S. Dollar Headwind",20220726T105300,"""Looking ahead, we updated our adjusted full-year expectations largely due to the strength of the U.S. dollar and uncertain macroeconomic environment,' said CEO Mike Roman.","[{'ticker': 'MMM', 'relevance_score': '0.273807', 'ticker_sentiment_score': '0.221197', 'ticker_sentiment_label': 'Somewhat-Bullish'}]"
Futures fall after Walmart warning spooks retail stocks,20220726T115800,"Traders work on the floor of the New York Stock Exchange ( NYSE ) in New York City, U.S., July 21, 2022. REUTERS/Brendan McDermid","[{'ticker': 'MMM', 'relevance_score': '0.121037', 'ticker_sentiment_score': '-0.078266', 'ticker_sentiment_label': 'Neutral'}]"
Stock Market Today - 7/26: Stocks Lower As Walmart Profit Warning Rattles Sentiment: Earnings Parade Floods Market,20220726T120200,"Walmart's surprise profit warning has cast a pall over the busiest earnings day of the year Tuesday, with stocks set to open lower as the Fed begins its key rate meeting.","[{'ticker': 'MMM', 'relevance_score': '0.082535', 'ticker_sentiment_score': '0.071403', 'ticker_sentiment_label': 'Neutral'}]"
Why Is 3M Stock Trading Higher?,20220726T131124,"3M Co MMM shares are trading higher Tuesday after the company reported better-than-expected financial results and announced plans to spin-off its health care business. 3M said second-quarter revenue declined 3% year-over-year to $8.7 billion, which beat the estimate of $8.58 billion, according to ...","[{'ticker': 'MMM', 'relevance_score': '0.491878', 'ticker_sentiment_score': '0.590728', 'ticker_sentiment_label': 'Bullish'}]"
"3M, General Electric And Some Other Big Stocks Moving Higher On Tuesday",20220726T155142,"Pagaya Technologies Ltd. PGY gained 30.7% to $12.52. The stock has seen continued volatility after the company completed its SPAC merger agreement last month. Covenant Logistics Group, Inc. CVLG climbed 15.8% to $33.84 following better-than-expected Q2 results.","[{'ticker': 'MMM', 'relevance_score': '0.262522', 'ticker_sentiment_score': '0.566579', 'ticker_sentiment_label': 'Bullish'}]"
3M Shares Gain As Q2 Results Exceed Street Expectation,20220726T161022,"3M Co MMM reported second-quarter FY22 net sales of $8.83 billion, a decline of 3% year-over-year, beating the consensus of $8.58 billion. Organic sales grew 1%, which included a 4% headwind from the combined impact of China's COVID-related lockdowns and decline in disposable respirator demand.","[{'ticker': 'MMM', 'relevance_score': '0.392948', 'ticker_sentiment_score': '-0.240837', 'ticker_sentiment_label': 'Somewhat-Bearish'}]"
Wall Street falls as Walmart warning rattles retail stocks; GE jumps,20220726T162700,"Walmart cuts profit forecast, drags retailers. McDonald's up as sales and profit top estimates. GE jumps on higher profit, Coca-Cola up on forecast raise ...","[{'ticker': 'MMM', 'relevance_score': '0.067536', 'ticker_sentiment_score': '0.0', 'ticker_sentiment_label': 'Neutral'}]"
Manufacturing Titan 3M Is Spinning Off Its Healthcare Business Into A Separate Company,20220726T165055,"With this, the manufacturing company formally enters the highly competitive healthcare industry.","[{'ticker': 'MMM', 'relevance_score': '0.08687', 'ticker_sentiment_score': '0.092547', 'ticker_sentiment_label': 'Neutral'}]"
"3M's  ( MMM )  Q2 Earnings & Revenues Beat Estimates, Decline Y/Y",20220726T171900,3M's (MMM) Q2 results are hurt by foreign-currency headwinds. The company lowers its 2022 adjusted earnings guidance on the same ground.,"[{'ticker': 'MMM', 'relevance_score': '0.1331', 'ticker_sentiment_score': '-0.002509', 'ticker_sentiment_label': 'Neutral'}]"
"The M&A Class Action Firm is Investigating the Mergers of NEOG, LJPC, and XPOA",20220726T180910,"NEW YORK, July 26, 2022 ( GLOBE NEWSWIRE ) -- Juan Monteverde, founder and managing partner of the class action firm Monteverde & Associates PC ( the ""M&A Class Action Firm"" ) , a national securities firm rated Top 50 in the 2018-2021 ISS Securities Class Action Services Report and headquartered ...","[{'ticker': 'MMM', 'relevance_score': '0.082393', 'ticker_sentiment_score': '0.089842', 'ticker_sentiment_label': 'Neutral'}]"
3M  ( MMM )  Q2 2022 Earnings Call Transcript,20220726T210048,"MMM earnings call for the period ending June 30, 2022.","[{'ticker': 'MMM', 'relevance_score': '0.003599', 'ticker_sentiment_score': '0.286319', 'ticker_sentiment_label': 'Somewhat-Bullish'}]"
"3M's $1 billion fund for resolving veterans' earplugs litigation not enough, says law professor",20220726T213200,"3M is facing claims related to its discontinued Combat Arms Earplugs version 2, which it sold to the U.S. military and consumers.","[{'ticker': 'MMM', 'relevance_score': '0.155451', 'ticker_sentiment_score': '-0.344607', 'ticker_sentiment_label': 'Somewhat-Bearish'}]"
Indices drop as Walmart profit warning spooks investors,20220727T005037,"Walmart ( WMT.N ) shares sank 7.6% after the retailer cut its full-year profit forecast late on Monday. Walmart blamed surging prices for food and fuel, and said it needed to cut prices to pare inventories.","[{'ticker': 'MMM', 'relevance_score': '0.07423', 'ticker_sentiment_score': '0.0', 'ticker_sentiment_label': 'Neutral'}]"
Alphabet To $160? Here Are 5 Other Price Target Changes for Wednesday,20220727T124531,"Wells Fargo cut the price target on Alphabet Inc. GOOGL from $170 to $160. However, Wells Fargo analyst Brian Fitzgerald maintained the stock with an Overweight. Alphabet shares rose 4.2% to $109.45 in pre-market trading.","[{'ticker': 'MMM', 'relevance_score': '0.459624', 'ticker_sentiment_score': '0.312451', 'ticker_sentiment_label': 'Somewhat-Bullish'}]"
Walmart To $142? Plus This Analyst Raises Price Target On McDonald's,20220727T130133,"Keybanc raised the price target for McDonald's Corporation MCD from $285 to $290. However, Keybanc analyst Eric Gonzalez maintained the stock with an Overweight rating. McDonald's shares fell 0.3% to $256.23 in pre-market trading. Citigroup cut the price target on Microsoft Corporation MSFT from ...","[{'ticker': 'MMM', 'relevance_score': '0.197413', 'ticker_sentiment_score': '-0.035024', 'ticker_sentiment_label': 'Neutral'}]"
"Amazon, 3M file lawsuit alleging counterfeit ring on Amazon.com.",20220727T131850,"Seattle-based Amazon and the 3M Company recently teamed up to sue more than 60 third-party sellers, alleging they peddled knock-off 3M medical equipment as part of a counterfeiting ring on Amazon's retail website. Driving the news: In lawsuits filed in U.S.","[{'ticker': 'MMM', 'relevance_score': '0.099476', 'ticker_sentiment_score': '-0.0097', 'ticker_sentiment_label': 'Neutral'}]"
Passive Fire Protection Market to Hit USD 5.4 Billion by 2028 | At CAGR of 4.5%,20220728T102713,"Pune, India, July 28, 2022 ( GLOBE NEWSWIRE ) -- The global passive fire protection market size is expected to gain momentum by reaching USD 5.4 billion by 2028 from USD 4.0 billion in 2021, while exhibiting a CAGR of 4.5% between 2021 to 2028.","[{'ticker': 'MMM', 'relevance_score': '0.040969', 'ticker_sentiment_score': '0.172021', 'ticker_sentiment_label': 'Somewhat-Bullish'}]"
3 Dow Jones Industrial Average Stocks For Your August 2022 Watchlist,20220801T191419,"Check Out These Three Dow Jones Industrial Average Stocks In The Stock Market Today The Dow Jones Industrial Average ( DJIA ) is a stock market index that tracks the performance of 30 large, publicly traded companies trading on the New York Stock Exchange ( NYSE ) and Nasdaq.","[{'ticker': 'MMM', 'relevance_score': '0.163354', 'ticker_sentiment_score': '0.228235', 'ticker_sentiment_label': 'Somewhat-Bullish'}]"
Honeywell Will Emerge Stronger From a Recession,20220803T090900,The industrial giant recently cheered the market by raising its full-year guidance.,"[{'ticker': 'MMM', 'relevance_score': '0.050786', 'ticker_sentiment_score': '-0.182894', 'ticker_sentiment_label': 'Somewhat-Bearish'}]"
3M Commences Split-Off Exchange Offer for Food Safety Business,20220804T164100,"ST. PAUL, Minn., Aug. 4, 2022 /PRNewswire/ -- 3M Company ( ""3M"" ) ( NYSE: MMM ) announced today the commencement of an exchange offer to effect the separation of its food safety business ( the ""Food Safety Business"" ) , in furtherance of the previously announced Reverse Morris Trust transaction ...","[{'ticker': 'MMM', 'relevance_score': '0.046573', 'ticker_sentiment_score': '0.170412', 'ticker_sentiment_label': 'Somewhat-Bullish'}]"
East metro officials want to make sure the 3M health care spinoff stays in the east metro,20220808T111030,"Whether it's St. Paul or elsewhere in the region, keeping this company in the Twin Cities is important to the regional economy.Whether it's St. Paul or elsewhere in the region, keeping this company in the Twin Cities is important to the regional economy.Local and regional leaders are hoping to ...","[{'ticker': 'MMM', 'relevance_score': '0.063763', 'ticker_sentiment_score': '0.072035', 'ticker_sentiment_label': 'Neutral'}]"
"Stock Market Today: Dow Jones, S&P 500 Drop Ahead Of Key Inflation Data; Novavax Stock Falls After Cutting Revenue Guidance",20220809T150010,"Stock market indices fell Tuesday morning ahead of key inflation data. The post Stock Market Today: Dow Jones, S&P 500 Drop Ahead Of Key Inflation Data. Novavax Stock Falls After Cutting Revenue Guidance appeared first on Stock Market News, Quotes, Charts and Financial Information | ...","[{'ticker': 'MMM', 'relevance_score': '0.127795', 'ticker_sentiment_score': '0.126815', 'ticker_sentiment_label': 'Neutral'}]"
"Stock Market Today: Dow Jones, S&P 500 Rally On Less-Than-Expected Inflation Report",20220810T151611,"On Wednesday morning, the Dow Jones Industrial Average rallied over 480 points. This comes after the Labor Department released the most recent consumer price index ( CPI ) report. In it, The consumer price index increased 8.5% in July from a year ago, which is under expectations, due largely to ...","[{'ticker': 'MMM', 'relevance_score': '0.114137', 'ticker_sentiment_score': '0.146776', 'ticker_sentiment_label': 'Neutral'}]"
"Top Analyst Reports for S&P Global, Sony & 3M",20220810T184000,"Today's Research Daily features new research reports on 16 major stocks, including S&P Global Inc. (SPGI), Sony Group Corporation (SONY), and 3M Company (MMM).","[{'ticker': 'MMM', 'relevance_score': '0.153961', 'ticker_sentiment_score': '0.081048', 'ticker_sentiment_label': 'Neutral'}]"
"The Zacks Analyst Blog Highlights S&P Global, Sony Group, 3M, Northrop Grumman and Shopify",20220811T130800,"S&P Global, Sony Group, 3M, Northrop Grumman and Shopify are part of Zacks top Analyst Blog.","[{'ticker': 'MMM', 'relevance_score': '0.145583', 'ticker_sentiment_score': '0.207484', 'ticker_sentiment_label': 'Somewhat-Bullish'}]"
"3M's Aearo Technologies Files For Bankruptcy To Get Out Of Her Courtroom, Federal Judge Says: WSJ",20220812T115723,"A month ago, many U.S. military veterans had filed lawsuits against 3M Co MMM for hearing impairment caused by faults in the company's military-grade earplugs.","[{'ticker': 'MMM', 'relevance_score': '0.197951', 'ticker_sentiment_score': '-0.100346', 'ticker_sentiment_label': 'Neutral'}]"
"Before The Bell: Johnson & Johnson To Stop Selling Talc-Based Powder, Google Fined $43M In Australia For Misleading Users Over Data Tracking, S&P Global Drops Coinbase Debt Rating And Other Top Financial Stories Friday, August 12",20220812T122124,"SK Hynix Inc HXSCL targeted a U.S. site for its advanced chip packaging plant and plans to break ground there around the first quarter of 2023. The plant, worth ""several billion,"" would ramp up to mass production by 2025-2026 and employ 1,000 workers.","[{'ticker': 'MMM', 'relevance_score': '0.051386', 'ticker_sentiment_score': '-0.175463', 'ticker_sentiment_label': 'Somewhat-Bearish'}]"
MRK: Dogs of the Dow: 2 Stocks to Buy and 2 to Hold,20220815T201026,"This year, the stock market suffered its worst first half in more than 50 years due to the Federal Reserve's aggressive interest rate hikes to tame the record-high inflation, the Russia-Ukraine war, lingering supply chain disruptions, and an economic slowdown.","[{'ticker': 'MMM', 'relevance_score': '0.188519', 'ticker_sentiment_score': '0.220795', 'ticker_sentiment_label': 'Somewhat-Bullish'}]"
Judge Knocks 3M Bankruptcy Strategy for Military Earplug Lawsuits,20220815T220200,A federal judge won't prohibit 3M from asserting a defense against mass earplug injury claims in the chapter 11 case of its Aearo unit.,"[{'ticker': 'MMM', 'relevance_score': '0.407844', 'ticker_sentiment_score': '-0.368519', 'ticker_sentiment_label': 'Bearish'}]"
Concrete Stamp Market in the Asia Pacific Region is Projected to Develop at the Rapid Pace | MDC Research,20220817T081122,"Pune, Aug. 17, 2022 ( GLOBE NEWSWIRE ) -- Concrete Stamp Market by Vendor Assessment, Technology Assessment, Partner & Customer Ecosystem, type/solution, service, organization size, end-use verticals, and Region - Global Concrete Stamp Market Forecast to 2030, published by Market Data Centre, ...","[{'ticker': 'MMM', 'relevance_score': '0.025985', 'ticker_sentiment_score': '-0.052353', 'ticker_sentiment_label': 'Neutral'}]"
Advanced Ceramics Market to Hit USD 97.0 Billion by 2030 at 3.7% CAGR - Report by Market Research Future  ( MRFR ) ,20220817T083000,"New York, USA, Aug. 17, 2022 ( GLOBE NEWSWIRE ) -- Advanced Ceramics Market Overview According to a Comprehensive Research Report by Market Research Future ( MRFR ) , ""Advanced Ceramics Market Information by Material, Product, End-User Industry and Region - Forecast till 2030"", the market is ...","[{'ticker': 'MMM', 'relevance_score': '0.026621', 'ticker_sentiment_score': '0.094512', 'ticker_sentiment_label': 'Neutral'}]"
Global Climate Resilient Technologies Market is Predicted to Grow at a Notable CAGR during 2022-2031; Rising Carbon Emission and Increasing Climatic Concerns Among Masses to Boost Growth - Research Nester,20220817T132359,"New York, Aug. 17, 2022 ( GLOBE NEWSWIRE ) -- Research Nester has published a detailed market report on 'Global Climate Resilient Technologies Market' for the forecast period, i.e. 2022 - 2031 which includes the following factors:","[{'ticker': 'MMM', 'relevance_score': '0.023767', 'ticker_sentiment_score': '0.151322', 'ticker_sentiment_label': 'Somewhat-Bullish'}]"
Neogen Shareholders Approve All Proposals Required for Combination with 3M's Food Safety Business,20220817T173000,"LANSING, Mich., Aug. 17, 2022 /PRNewswire/ -- Neogen Corporation ( ""Neogen"" ) ( NASDAQ: NEOG ) announced that, at the special meeting of Neogen shareholders held today, Neogen shareholders voted to approve all proposals required in connection with the pending combination of the food safety ...","[{'ticker': 'MMM', 'relevance_score': '0.052627', 'ticker_sentiment_score': '0.131604', 'ticker_sentiment_label': 'Neutral'}]"
"Adhesive Tapes Market Size US$ 89.44 Billion by 2028, at a CAGR of 5.1% - Global Analysis of 18+ Countries across 5 Key Regions, 50+ Companies Scrutinized by The Insight Partners",20220818T122636,"New York, Aug. 18, 2022 ( GLOBE NEWSWIRE ) -- According to our new research study on Adhesive Tapes Market and films are used to bond or join the objects instead of using screws, fasteners, or welding.","[{'ticker': 'MMM', 'relevance_score': '0.017108', 'ticker_sentiment_score': '0.047395', 'ticker_sentiment_label': 'Neutral'}]"
Medical Clothing Market: Demand for Medical Clothing to Increase by 150% by 2028 | SkyQuest Technology,20220818T122702,"Westford, USA, Aug. 18, 2022 ( GLOBE NEWSWIRE ) -- Recent years have seen a growing demand in the global medical clothing market, as hospitals and clinics across the globe continue to see an increase in patients with infections and other illnesses.","[{'ticker': 'MMM', 'relevance_score': '0.029436', 'ticker_sentiment_score': '0.134107', 'ticker_sentiment_label': 'Neutral'}]"
3M Unit Defends Request to Shield Parent From Mass Earplug Lawsuits,20220818T150300,"Lawyers representing 3M's bankrupt Aearo Technologies subsidiary defended its request to extend a litigation stay to the parent company to resolve mass earplug lawsuits, saying such a move would be in line with other court rulings.","[{'ticker': 'MMM', 'relevance_score': '0.29234', 'ticker_sentiment_score': '-0.266057', 'ticker_sentiment_label': 'Somewhat-Bearish'}]"
Battery Electrolyte Market Robust Expansion is Expected From 2022-2030 | MDC Research,20220819T104110,"Pune, Aug. 19, 2022 ( GLOBE NEWSWIRE ) -- Battery Electrolyte Market by Vendor Assessment, Technology Assessment, Partner & Customer Ecosystem, type/solution, service, organization size, end-use verticals, and Region - Global Battery Electrolyte Market Forecast to 2030, published by Market Data ...","[{'ticker': 'MMM', 'relevance_score': '0.025901', 'ticker_sentiment_score': '0.0', 'ticker_sentiment_label': 'Neutral'}]"
3 Top Dividend Kings to Buy for the Long Haul,20220820T143700,These reliable companies are a good buy now for a long-term investor.,"[{'ticker': 'MMM', 'relevance_score': '0.093836', 'ticker_sentiment_score': '0.15725', 'ticker_sentiment_label': 'Somewhat-Bullish'}]"
Automotive Aftermarket is Riding the Wave of Growth and is Expected to Reach USD 568.10 Billion by 2030 | MDC Research,20220822T123148,"Pune, Aug. 22, 2022 ( GLOBE NEWSWIRE ) -- Automotive Aftermarket by Vendor Assessment, Technology Assessment, Partner & Customer Ecosystem, type/solution, service, organization size, end-use verticals, and Region - Global Automotive Aftermarket Forecast to 2030, published by Market Data Centre, ...","[{'ticker': 'MMM', 'relevance_score': '0.027072', 'ticker_sentiment_score': '0.0', 'ticker_sentiment_label': 'Neutral'}]"
Top gainers and losers on a day when S&P 500 logged its worst session since June 16 | The Financial Express,20220823T125827,Top gainers and losers on a day when S&P 500 logged its worst session since June 16 The Financial Express ...,"[{'ticker': 'MMM', 'relevance_score': '0.088799', 'ticker_sentiment_score': '-0.069949', 'ticker_sentiment_label': 'Neutral'}]"
This Company Believes Biometrics Could Be One Of The New Super Powers Of The Digital World,20220823T153029,"In March 2017, Netflix's official Twitter Inc. TWTR account tweeted ""love is sharing a password."" Five years later, media reports created a furor, hinting that Netflix was considering ways to curtail password sharing with people beyond the main user's household.","[{'ticker': 'MMM', 'relevance_score': '0.099271', 'ticker_sentiment_score': '0.17947', 'ticker_sentiment_label': 'Somewhat-Bullish'}]"
Amgen Touts Positive Data From Soliris-Based Biosimilar For Rare Blood Disorder,20220823T154311,"Amgen Inc AMGN has announced topline results from the DAHLIA study crossover Phase 3 study of ABP 959, a biosimilar candidate to Soliris ( eculizumab ) in paroxysmal nocturnal hemoglobinuria ( PNH ) .","[{'ticker': 'MMM', 'relevance_score': '0.083107', 'ticker_sentiment_score': '0.171932', 'ticker_sentiment_label': 'Somewhat-Bullish'}]"
Sorrento Shares Pop After Interim Data From Lung Cancer Trial,20220823T155816,"Sorrento Therapeutics Inc SRNE announced positive results from a pivotal study of Abivertinib on 209 response evaluable, heavily pretreated NSCLC patients by an IRC assessment with matured long-term follow-up data.","[{'ticker': 'MMM', 'relevance_score': '0.08183', 'ticker_sentiment_score': '0.171453', 'ticker_sentiment_label': 'Somewhat-Bullish'}]"
Meet The Company Creating Novel Products For The Treatment Of ADHD,20220823T173345,"Sign up for this week's All Access giveaway here! Shane Schaffer, CEO of Cingulate, Inc. CING, was a guest on Benzinga's All Access on August 22, 2022.","[{'ticker': 'MMM', 'relevance_score': '0.09239', 'ticker_sentiment_score': '0.175941', 'ticker_sentiment_label': 'Somewhat-Bullish'}]"
Moderna Plans US Application Submission For COVID-19 Omicron Adapted Booster 'Very Soon',20220823T192856,"Moderna Inc MRNA plans to file data with the FDA very soon, seeking approval for a booster shot targeting the latest omicron Covid variants, Bloomberg reported.","[{'ticker': 'MMM', 'relevance_score': '0.079921', 'ticker_sentiment_score': '0.170771', 'ticker_sentiment_label': 'Somewhat-Bullish'}]"
"Mizuho Is Bullish On This Schizophrenia-Focused Stock, Read Why",20220823T193236,"Mizuho updated the price target for Cerevel Therapeutics Holdings Inc CERE from $27 to $32 keeping the Neutral rating. The updated model reflects additional de-risking of emraclidine ( a novel M4 PAM for schizophrenia ) following the announcement of positive Phase 3 data for KarXT, a similarly ...","[{'ticker': 'MMM', 'relevance_score': '0.081001', 'ticker_sentiment_score': '0.171152', 'ticker_sentiment_label': 'Somewhat-Bullish'}]"
"Boxed Warnings May Not Hinder This Depression Drug's Broad Market Penetration, Analyst Says",20220823T193430,"Last week, Axsome Therapeutics Inc's AXSM major depression candidate received the much-awaited FDA approval. HC Wainwright notes that the approval comes roughly a year after the original Prescription Drug User Fee Act ( PDUFA ) decision date.","[{'ticker': 'MMM', 'relevance_score': '0.079788', 'ticker_sentiment_score': '0.170725', 'ticker_sentiment_label': 'Somewhat-Bullish'}]"
Recap Of Tuesday's Biotech Catalysts - End Of the Day Summary,20220823T225342,The U.S. Food and Drug Administration ( FDA ) has granted Fast Track designation for Merck's MRK lead asset MK-2060 for the reduction in risk of major thrombotic cardiovascular events in patients with end-stage renal disease ( ESRD ) .,"[{'ticker': 'MMM', 'relevance_score': '0.053749', 'ticker_sentiment_score': '0.166001', 'ticker_sentiment_label': 'Somewhat-Bullish'}]"
"Automotive In-Vehicle Air Purifier Market to Record a CAGR of 9.78%, Growth in Multi-functional Car Air Purifier to be a Key Trend - Technavio",20220824T051500,"NEW YORK, Aug. 24, 2022 /PRNewswire/ -- One of the key trends in the automotive in-vehicle air purifier market is the growth in multi-functional car air purifiers. The market is witnessing the development of multi-functional, compact, and simple user interface products to improve the quality and ...","[{'ticker': 'MMM', 'relevance_score': '0.046452', 'ticker_sentiment_score': '-0.003951', 'ticker_sentiment_label': 'Neutral'}]"
EXCLUSIVE: BioRestorative Therapies Adds Additional Sites For Lumbar Disc Disease Trial,20220824T103045,BioRestorative Therapies Inc BRTX has entered into agreements with Vantage Clinical Trials LLC for its Phase 2 trial targeting chronic lumbar disc disease ( cLDD ) . Vantage Clinical Trials LLC is located in Florida and brings three separate clinical sites to BioRestortive's Phase 2 trial.,"[{'ticker': 'MMM', 'relevance_score': '0.08183', 'ticker_sentiment_score': '0.171453', 'ticker_sentiment_label': 'Somewhat-Bullish'}]"
Ainos Seeks FDA Nod For Mid-Stage Covid-19 Study,20220824T115038,"Ainos, Inc. AIMD has submitted an Investigational New Drug ( IND ) application to the U.S. Food and Drug Administration for conducting a Phase 2 trial of its drug candidate VELDONA, for treatment of mild symptoms related to COVID-19.","[{'ticker': 'MMM', 'relevance_score': '0.077218', 'ticker_sentiment_score': '0.169877', 'ticker_sentiment_label': 'Somewhat-Bullish'}]"
Bavarian Nordic Making All Efforts To Stretch Capacity To Boost Monkeypox Vaccine Supplies,20220824T120945,"Bavarian Nordic A/S BVNRY said it was making ""every effort"" to meet the high demand for its monkeypox vaccine worldwide as it kept its business outlook for the year. The Danish biotech's CEO said the outbreak was ""unprecedented"" in its first-half results.","[{'ticker': 'MMM', 'relevance_score': '0.073098', 'ticker_sentiment_score': '0.168682', 'ticker_sentiment_label': 'Somewhat-Bullish'}]"
Annovis Shares Gain As Late-Stage Parkinson's Disease Study Takes-off,20220824T122542,"Annovis Bio, Inc. ANVS has initiated patient dosing in the Phase 3 clinical trial evaluating buntanetap in early Parkinson's Disease ( PD ) . The Phase 3 trial is designed to evaluate the efficacy, safety, and tolerability of buntanetap, will enroll upto 450 early PD patients.","[{'ticker': 'MMM', 'relevance_score': '0.072765', 'ticker_sentiment_score': '0.168594', 'ticker_sentiment_label': 'Somewhat-Bullish'}]"
