title,time_published,summary,ticker_sentiment
"Global Transdermal Skin Patches Market Forecast Report, 2024-2030: A $9.9B Projected Industry, Dominated by Teva Pharma, 3M Company, Nitto Denko Corporation, and Johnson & Johnson",20240119T171500,"Global Transdermal Skin Patches Market Forecast Report, 2024-2030: A $9.9B Projected Industry, Dominated by Teva ... PR ...","[{'ticker': 'MMM', 'relevance_score': '0.063425', 'ticker_sentiment_score': '0.126538', 'ticker_sentiment_label': 'Neutral'}]"
USD 1.78 billion growth in IT market in Qatar from 2022 to 2027; Growth driven by Increased adoption of mobility ... - PR Newswire,20240119T230000,USD 1.78 billion growth in IT market in Qatar from 2022 to 2027. Growth driven by Increased adoption of mobility ... PR ...,"[{'ticker': 'MMM', 'relevance_score': '0.07887', 'ticker_sentiment_score': '0.080136', 'ticker_sentiment_label': 'Neutral'}]"
Can General Electric  ( GE )  Q4 Earnings Beat on Aerospace Boost?,20240120T011800,Strength in the Aerospace segment and accretive acquisitions are likely to aid General Electric's (GE) fourth-quarter 2023 results.,"[{'ticker': 'MMM', 'relevance_score': '0.104911', 'ticker_sentiment_score': '0.0', 'ticker_sentiment_label': 'Neutral'}]"
The 4 most important things we're watching in the stock market this coming week,20240120T151348,On tap: A handful of key economic updates and a ramp up of quarterly earnings reports.,"[{'ticker': 'MMM', 'relevance_score': '0.042234', 'ticker_sentiment_score': '-0.028099', 'ticker_sentiment_label': 'Neutral'}]"
"Battery Chemicals Market is forecasted to achieve a valuation of US$111.9 Billion by 2030, according to the predictions made by Persistence Market Research",20240122T060000,"New York, Jan. 22, 2024 ( GLOBE NEWSWIRE ) -- Battery Chemicals Market Soars: Powering the Future of Clean Energy Battery Chemicals encompass a range of materials used in the production and maintenance of batteries.","[{'ticker': 'MMM', 'relevance_score': '0.017638', 'ticker_sentiment_score': '0.173479', 'ticker_sentiment_label': 'Somewhat-Bullish'}]"
Dental Surgical Equipment Market size to Grow by USD 2.10 billion from 2022 to 2027; Surging demand for cutting ... - PR Newswire,20240122T092000,Dental Surgical Equipment Market size to Grow by USD 2.10 billion from 2022 to 2027. Surging demand for cutting ... PR ...,"[{'ticker': 'MMM', 'relevance_score': '0.062434', 'ticker_sentiment_score': '0.131062', 'ticker_sentiment_label': 'Neutral'}]"
"Tesla, Netflix, Intel Take Center Stage In Pivotal Q4 Earnings Week As S&P 500 Eyes Breaking New Highs - SPDR S&P 500  ( ARCA:SPY ) ",20240122T100045,"The earnings season is gaining momentum as the tech reporting season kicks off this week. With the S&P 500 Index reaching a new high on Friday, investors are keenly watching earnings reports to sustain the market's upward momentum.","[{'ticker': 'MMM', 'relevance_score': '0.107255', 'ticker_sentiment_score': '0.049774', 'ticker_sentiment_label': 'Neutral'}]"
"Metal Cleaners Market Expected to Thrive with a Robust CAGR of 4.9% Until 2032, According to Persistence Market Research",20240122T104500,"New York, Jan. 22, 2024 ( GLOBE NEWSWIRE ) -- Market Size & Overview: The global metal cleaners market achieved a revenue of US$ 13 billion in 2023 and is anticipated to reach US$ 22 billion by the close of 2032, showcasing a consistent Compound Annual Growth Rate ( CAGR ) of 4.9% from 2022 ...","[{'ticker': 'MMM', 'relevance_score': '0.023885', 'ticker_sentiment_score': '0.339722', 'ticker_sentiment_label': 'Somewhat-Bullish'}]"
This Dividend King Soared 18.9% in 2023. Is There More Room to Run in 2024?,20240122T105300,"Illinois Tool Works is a perfect example of why it's always better to invest in a quality business, even if it is on the expensive side.","[{'ticker': 'MMM', 'relevance_score': '0.04303', 'ticker_sentiment_score': '0.120268', 'ticker_sentiment_label': 'Neutral'}]"
How To Earn $500 A Month From 3M Stock Ahead Of Q4 Earnings Print - 3M  ( NYSE:MMM ) ,20240122T133852,"3M Company MMM is expected to release earnings results for its fourth quarter before the opening bell on Jan. 23, 2024. Analysts expect the Saint Paul, Minnesota-based company to report quarterly earnings at $2.31 per share on revenue of $7.70 billion, according to data from Benzinga Pro.","[{'ticker': 'MMM', 'relevance_score': '0.348919', 'ticker_sentiment_score': '0.306932', 'ticker_sentiment_label': 'Somewhat-Bullish'}]"
The Blood Warmers Market Is Expected To Grow To $1.7 Billion By 2028 At CAGR Of More Than 8% As Per The Business Research Company's Blood Warmers Global Market Report 2024,20240122T163000,"LONDON, Jan. 22, 2024 ( GLOBE NEWSWIRE ) -- As per The Business Research Company's Blood Warmers Global Market Report 2024, the global blood warmers market has exhibited robust growth in recent years, and the momentum is expected to continue in the coming years.","[{'ticker': 'MMM', 'relevance_score': '0.056275', 'ticker_sentiment_score': '0.230099', 'ticker_sentiment_label': 'Somewhat-Bullish'}]"
"Disinfection Cap Market Set for a 5.7%CAGR, Valued at US$0.57 Billion by 2030 | Persistence Market Research",20240123T103000,"New York, Jan. 23, 2024 ( GLOBE NEWSWIRE ) -- Market Size & Overview: The global Disinfection Cap Market is anticipated to experience substantial growth, with a projected Compound Annual Growth Rate ( CAGR ) of 5.7%.","[{'ticker': 'MMM', 'relevance_score': '0.018757', 'ticker_sentiment_score': '0.044683', 'ticker_sentiment_label': 'Neutral'}]"
"US Stocks Prepare For Nervy Start Ahead of Netflix, TI Earnings: Analyst Says Cash Waiting On Sidelines Could Flood Street If This Happens - Invesco QQQ Trust, Series 1  ( NASDAQ:QQQ ) , SPDR S&P 500  ( ARCA:SPY ) ",20240123T123203,The mood turned circumspect on Tuesday as traders digested a deluge of earnings reports and anticipated market-moving economic data for the week. Earnings releases from 3M Company MMM and General Electric Co. GE led to a pullback in their stocks during premarket trading.,"[{'ticker': 'MMM', 'relevance_score': '0.10607', 'ticker_sentiment_score': '0.022026', 'ticker_sentiment_label': 'Neutral'}]"
Why Is Post-It Maker 3M Stock Sinking Premarket Tuesday? Why Is Post-It Maker 3M  ( MMM )  Stock Sinking Premarket Tuesday? - 3M  ( NYSE:MMM ) ,20240123T124152,"3M Company MMM shares are trading lower premarket after the company reported better-than-expected fourth-quarter EPS but issued FY24 Adj EPS guidance below estimates. The company reported adjusted net sales of $7.69 billion, a decline of 0.3%Y/Y, missing the consensus of $7.70 billion.","[{'ticker': 'MMM', 'relevance_score': '0.490323', 'ticker_sentiment_score': '0.438945', 'ticker_sentiment_label': 'Bullish'}]"
3M's stock tanks after 2024 earnings outlook comes in well below forecasts,20240123T124600,"3M's stock tanked Tuesday, after the consumer, industrial and healthcare-products company provided a 2024 profit outlook that was well below forecasts, which overshadowed fourth-quarter results that topped expectations.","[{'ticker': 'MMM', 'relevance_score': '0.223866', 'ticker_sentiment_score': '0.087832', 'ticker_sentiment_label': 'Neutral'}]"
"Surface Computing Market Projected to Reach a Staggering US$ 480.0 Billion by 2033, Insights by Persistence Market Research",20240123T141427,"New York, Jan. 23, 2024 ( GLOBE NEWSWIRE ) -- The global Surface Computing market is experiencing significant growth propelled by technological advancements, increasing demand for interactive user interfaces, and a growing focus on enhancing user experiences.","[{'ticker': 'MMM', 'relevance_score': '0.019618', 'ticker_sentiment_score': '0.178274', 'ticker_sentiment_label': 'Somewhat-Bullish'}]"
3M's Earnings Beat Not Enough: Analyst Stays Neutral After Disappointing Revenue Performance - 3M  ( NYSE:MMM ) ,20240123T162044,"Shares of 3M Co MMM tanked in early trading on Tuesday, after the company reported its quarterly results. While the company reported its earnings slightly ahead of Street expectations, it posted a top line miss, with organic growth remaining weaker than expected, according to BofA Securities.","[{'ticker': 'MMM', 'relevance_score': '0.454174', 'ticker_sentiment_score': '-0.04613', 'ticker_sentiment_label': 'Neutral'}]"
"3M  ( MMM )  Q4 Earnings Beat Estimates, Revenues Decline Y/Y",20240123T174100,"3M (MMM) reports fourth-quarter 2023 results, wherein its revenues inch down by 0.8% year over year.","[{'ticker': 'MMM', 'relevance_score': '0.27535', 'ticker_sentiment_score': '0.0774', 'ticker_sentiment_label': 'Neutral'}]"
"US Stocks Pause As Treasury Yields, Dollar Surge On Trimmed Fed Rate Cut Bets: What's Driving Markets Tuesday? - Alibaba Gr Holding  ( NYSE:BABA ) ",20240123T190743,"Wall Street took a breather on Tuesday, with the major U.S. stock indices trading near the flatline or showing slight declines during midday trading in New York as investors closely await a series of relevant earnings reports and crucial economic data slated for the remainder of the week.","[{'ticker': 'MMM', 'relevance_score': '0.151064', 'ticker_sentiment_score': '-0.210684', 'ticker_sentiment_label': 'Somewhat-Bearish'}]"
"Investor Optimism Improves Following Earnings Reports; S&P 500 Reaches Another High - Abbott Laboratories  ( NYSE:ABT ) , IBM  ( NYSE:IBM ) ",20240124T084959,"The CNN Money Fear and Greed index showed a further increase in overall market sentiment, while the index remained in the ""Greed"" zone on Tuesday. U.S. stocks closed mixed on Tuesday, with the Dow Jones index snapping a three-day winning streak. However, the S&P 500 hit a new all-time closing ...","[{'ticker': 'MMM', 'relevance_score': '0.231332', 'ticker_sentiment_score': '0.525561', 'ticker_sentiment_label': 'Bullish'}]"
"Nasdaq, S&P 500 Futures Jump As Wall Street Eagerly Awaits Tesla's Q4 Earnings: Analyst Says Rally Broadening But Favors These Stocks - Invesco QQQ Trust, Series 1  ( NASDAQ:QQQ ) , SPDR S&P 500  ( ARCA:SPY ) ",20240124T124145,"U.S. stock futures indicate a positive opening on Wednesday, buoyed by strong earnings reports from Netflix, Inc. NFLX and semiconductor equipment maker ASML Holding N.V. ASML. Investors are eagerly awaiting Tesla, Inc.'s TSLA fourth-quarter results, which are expected to take center stage.","[{'ticker': 'MMM', 'relevance_score': '0.115787', 'ticker_sentiment_score': '-0.100818', 'ticker_sentiment_label': 'Neutral'}]"
"Cathie Wood Sees Fed Cutting Interest Rates, Stopping 'Rolling Recession' - SPDR S&P 500  ( ARCA:SPY ) ",20240124T182623,"Investor Cathie Wood regularly shares her opinions on the macroeconomic environment and what could be ahead for stocks. On Tuesday, Wood doubled down on her belief in a deflationary environment in 2024.","[{'ticker': 'MMM', 'relevance_score': '0.233556', 'ticker_sentiment_score': '0.0', 'ticker_sentiment_label': 'Neutral'}]"
Orthodontic Supplies Global Market Report 2024: Projected Growth Rate and Market Size As Per The Business Research Company's Orthodontic Supplies Global Market Report 2024,20240125T163000,"LONDON, Jan. 25, 2024 ( GLOBE NEWSWIRE ) -- As per The Business Research Company's Orthodontic Supplies Global Market Report 2024, the orthodontic supplies market has witnessed robust growth, and this trend is expected to continue in the coming years.","[{'ticker': 'MMM', 'relevance_score': '0.05833', 'ticker_sentiment_score': '0.352221', 'ticker_sentiment_label': 'Bullish'}]"
Electrical Conductors Market for the Power Industry: USD 13.8 Billion Growth Forecasted at a CAGR of 6.78% between ... - PR Newswire,20240128T102000,Electrical Conductors Market for the Power Industry: USD 13.8 Billion Growth Forecasted at a CAGR of 6.78% between ... PR ...,"[{'ticker': 'MMM', 'relevance_score': '0.068502', 'ticker_sentiment_score': '0.091281', 'ticker_sentiment_label': 'Neutral'}]"
"3M says earplug-litigation settlement on track, will pay $1 billion of total in cash",20240129T114400,"The case is the largest mass tort in U.S. history, exceeding even asbestos and opioid claims.","[{'ticker': 'MMM', 'relevance_score': '0.105141', 'ticker_sentiment_score': '-0.02857', 'ticker_sentiment_label': 'Neutral'}]"
"Natural Language Processing Market size worth $ 65.38 Billion, Globally, by 2030 at 19.49% CAGR - Report By Verified Market Research®",20240205T151500,"Jersey City, New Jersey, Feb. 05, 2024 ( GLOBE NEWSWIRE ) -- The Global Natural Language Processing Market is projected to grow at a CAGR of 19.49% from 2022 to 2030, according to a new report published by Verified Market Research®.","[{'ticker': 'MMM', 'relevance_score': '0.031654', 'ticker_sentiment_score': '0.130541', 'ticker_sentiment_label': 'Neutral'}]"
Fall Protection Market to grow by USD 3.02 billion from 2022 to 2027; market is fragmented due to the presence of ... - PR Newswire,20240206T022400,Fall Protection Market to grow by USD 3.02 billion from 2022 to 2027. market is fragmented due to the presence of ... PR ...,"[{'ticker': 'MMM', 'relevance_score': '0.09186', 'ticker_sentiment_score': '0.192361', 'ticker_sentiment_label': 'Somewhat-Bullish'}]"
"Carlisle  ( CSL )  Q4 Earnings Beat Estimates, Revenues Decline Y/Y",20240207T151800,Carlisle (CSL) fourth-quarter 2023 results benefit from higher revenues across the Carlisle Construction Materials segment.,"[{'ticker': 'MMM', 'relevance_score': '0.127795', 'ticker_sentiment_score': '0.183383', 'ticker_sentiment_label': 'Somewhat-Bullish'}]"
"The global hydrogel dressing market size, as forecasted by Straits Research, is poised to hit USD 996.75 million by 2031, experiencing substantial growth at a CAGR of 9.9%",20240207T153000,"New York, United States, Feb. 07, 2024 ( GLOBE NEWSWIRE ) -- Hydrogel is an insoluble polymer chain network crucial in wound care due to its high moisture content, which prevents infections by inhibiting microbes.","[{'ticker': 'MMM', 'relevance_score': '0.03473', 'ticker_sentiment_score': '-0.072045', 'ticker_sentiment_label': 'Neutral'}]"
"Global Skin Barriers Market Size is Estimated to Reach USD 428.15 Million by 2031, Growing at a CAGR of 3.9%: Straits Research",20240208T134500,"New York, United States, Feb. 08, 2024 ( GLOBE NEWSWIRE ) -- The containment of stool with a liquid or semiliquid consistency is managed with a skin barrier. It aids people with fecal incontinence in keeping their skin free of irritants and dampness, which can promote skin breakdown.","[{'ticker': 'MMM', 'relevance_score': '0.034933', 'ticker_sentiment_score': '0.003876', 'ticker_sentiment_label': 'Neutral'}]"
"ITT Q4 Earnings In Line With Estimates, Revenues Increase Y/Y",20240209T160100,"ITT's Q4 revenues increase 7% year over year, driven by higher Friction original equipment volumes in the Motion Technologies segment and pricing actions in the Connect & Control Technologies segment.","[{'ticker': 'MMM', 'relevance_score': '0.091684', 'ticker_sentiment_score': '0.163779', 'ticker_sentiment_label': 'Somewhat-Bullish'}]"
"Global Sterilization Equipment Market Size is Estimated to Reach USD 19.80 Billion by 2031, Growing at a CAGR of 9.15%: Straits Research",20240212T120000,"New York, United States, Feb. 12, 2024 ( GLOBE NEWSWIRE ) -- Sterilization equipment or sterilizers are utilized to reduce microbial contamination or the presence of pathogenic substances on the surfaces of medicinal preparations, medical devices, and instruments.","[{'ticker': 'MMM', 'relevance_score': '0.066784', 'ticker_sentiment_score': '0.030039', 'ticker_sentiment_label': 'Neutral'}]"
"Wall Street's Most Accurate Analysts' Views On 3 Industrials Stocks With Over 4% Dividend Yields - Copa Holdings  ( NYSE:CPA ) , 3M  ( NYSE:MMM ) ",20240215T122443,"During times of turbulence and uncertainty in the markets, many investors turn to dividend-yielding stocks. These are often companies that have high free cash flows and reward shareholders with a high dividend payout.","[{'ticker': 'MMM', 'relevance_score': '0.111488', 'ticker_sentiment_score': '0.307913', 'ticker_sentiment_label': 'Somewhat-Bullish'}]"
Can 3M Company Double in 5 Years? Here's What It Would Take,20240216T101600,This Dividend King's tarnished crown could someday regain its shine.,"[{'ticker': 'MMM', 'relevance_score': '0.096671', 'ticker_sentiment_score': '-0.006736', 'ticker_sentiment_label': 'Neutral'}]"
Global Neonatal Intensive Care Analysis Report 2024: Market to Reach $5.23 Billion by 2030 - Enhanced NICU Access and Quality Driven by Global Recognition of Neonatal Care Importance,20240216T193000,Global Neonatal Intensive Care Analysis Report 2024: Market to Reach $5.23 Billion by 2030 - Enhanced NICU Access ... PR ...,"[{'ticker': 'MMM', 'relevance_score': '0.036587', 'ticker_sentiment_score': '0.227041', 'ticker_sentiment_label': 'Somewhat-Bullish'}]"
Should Invesco Dow Jones Industrial Average Dividend ETF  ( DJD )  Be on Your Investing Radar?,20240222T112004,Style Box ETF report for ...,"[{'ticker': 'MMM', 'relevance_score': '0.125789', 'ticker_sentiment_score': '0.069184', 'ticker_sentiment_label': 'Neutral'}]"
Best Long-Term Stocks To Buy Today? 2 Dividend Stocks To Know,20240227T143457,"The stock market is a complex ecosystem where shares of public companies are bought, sold, and traded. It serves as a critical component of the global economy. For example, facilitating capital raising for companies and investment opportunities for individuals and institutions.","[{'ticker': 'MMM', 'relevance_score': '0.2872', 'ticker_sentiment_score': '0.135697', 'ticker_sentiment_label': 'Neutral'}]"
3M To Spin-Off Solventum Unit Tax-Free To Shareholders,20240227T170112,"On February 21, 2024, 3M Company ( NYSE: MMM, $91.82, Market Capitalization: $50.7 billion ) , a diversified global manufacturer, technology innovator, and marketer of a variety of products, announced the filing of a Form 10 registration statement with the U.S.","[{'ticker': 'MMM', 'relevance_score': '0.193023', 'ticker_sentiment_score': '0.198812', 'ticker_sentiment_label': 'Somewhat-Bullish'}]"
Here's Why General Electric Stock Surged in February,20240304T095134,"Investors liked the look of the company's ongoing earnings and its forthcoming spinoff, GE Vernova.","[{'ticker': 'MMM', 'relevance_score': '0.088472', 'ticker_sentiment_score': '0.098929', 'ticker_sentiment_label': 'Neutral'}]"
Is Invesco Dow Jones Industrial Average Dividend ETF  ( DJD )  a Strong ETF Right Now?,20240306T112006,Smart Beta ETF report for ...,"[{'ticker': 'MMM', 'relevance_score': '0.117486', 'ticker_sentiment_score': '0.060435', 'ticker_sentiment_label': 'Neutral'}]"
Better High-Yield Dividend Stock: Verizon or 3M?,20240310T114300,One of these high-yield Dow Jones stocks stands out as the better buy.,"[{'ticker': 'MMM', 'relevance_score': '0.174587', 'ticker_sentiment_score': '0.32991', 'ticker_sentiment_label': 'Somewhat-Bullish'}]"
1 Wall Street Analyst Warns That 3M Stock Has 9% Downside Risk,20240311T123300,"When 3M loses Solventum, will it also end up cutting its dividend?","[{'ticker': 'MMM', 'relevance_score': '0.249106', 'ticker_sentiment_score': '0.252785', 'ticker_sentiment_label': 'Somewhat-Bullish'}]"
Why 3M Shares Are Shooting Higher Today - 3M  ( NYSE:MMM ) ,20240312T170526,"3M Company MMM shares are trading higher after the company said William M. Bill Brown is appointed chief executive officer, effective May 1, 2024. Brown will succeed Michael Roman, who is appointed as Executive Chairman of the Board, also effective May 1, 2024.","[{'ticker': 'MMM', 'relevance_score': '0.574235', 'ticker_sentiment_score': '0.52779', 'ticker_sentiment_label': 'Bullish'}]"
"Industrial Gloves Market Size is Projected to Reach USD 20.8 billion by 2031, Growth at CAGR 12.6% | Report by Transparency Market Research, Inc.",20240313T113800,"Wilmington, Delaware, United States, March 13, 2024 ( GLOBE NEWSWIRE ) -- Transparency Market Research Inc. - The market valuation measured for the global industrial gloves market in 2022 was about US$ 8.6 billion.","[{'ticker': 'MMM', 'relevance_score': '0.042271', 'ticker_sentiment_score': '0.060306', 'ticker_sentiment_label': 'Neutral'}]"
"Stock Market News for Mar 13, 2024",20240313T135400,"Wall Street closed sharply higher on Tuesday, led by technology stocks.","[{'ticker': 'MMM', 'relevance_score': '0.142565', 'ticker_sentiment_score': '0.250854', 'ticker_sentiment_label': 'Somewhat-Bullish'}]"
3M  ( MMM )  Soars 5.4%: Is Further Upside Left in the Stock?,20240314T092900,3M (MMM) was a big mover last session on higher-than-average trading volume. The latest trend in earnings estimate revisions might not help the stock continue moving higher in the near term.,"[{'ticker': 'MMM', 'relevance_score': '0.316168', 'ticker_sentiment_score': '0.271215', 'ticker_sentiment_label': 'Somewhat-Bullish'}]"
"S&P 500, Nasdaq Set For Strong Open Today Ahead Of PPI Data: What's Moving Stock Futures? - Invesco QQQ Trust, Series 1  ( NASDAQ:QQQ ) , SPDR S&P 500  ( ARCA:SPY ) ",20240314T113929,"As traders harbor hopes that the Federal Reserve will take down interest rates in the first half of the year, the broader trend is to the upside amid occasional minor corrections. Stock futures are pointing up on Thursday.","[{'ticker': 'MMM', 'relevance_score': '0.076602', 'ticker_sentiment_score': '0.069291', 'ticker_sentiment_label': 'Neutral'}]"
Market Cap Game Show: Andy Cross vs. Emily Flippen,20240314T155020,Test your knowledge of companies' value on the stock market.,"[{'ticker': 'MMM', 'relevance_score': '0.007471', 'ticker_sentiment_score': '-0.040913', 'ticker_sentiment_label': 'Neutral'}]"
"German Conglomerate Bayer Goes Johnson & Johnson Way To Tackle Its Cancer Related Lawsuits - Bayer  ( OTC:BAYRY ) , Bayer  ( OTC:BAYZF ) ",20240314T195901,Bayer AG BAYRY BAYZF is reportedly considering utilizing the Texas Two-Step bankruptcy approach to tackle the onslaught of lawsuits in the United States implicating its Roundup weedkiller causing cancer.,"[{'ticker': 'MMM', 'relevance_score': '0.224903', 'ticker_sentiment_score': '0.0', 'ticker_sentiment_label': 'Neutral'}]"
Is SPDR S&P Dividend ETF  ( SDY )  a Strong ETF Right Now?,20240315T102005,Smart Beta ETF report for ...,"[{'ticker': 'MMM', 'relevance_score': '0.114137', 'ticker_sentiment_score': '0.054204', 'ticker_sentiment_label': 'Neutral'}]"
"Paints and coatings market to grow by USD 38.25 billion between 2024 and 2028, APAC to occupy 53% market share ... - PR Newswire",20240315T141200,"Paints and coatings market to grow by USD 38.25 billion between 2024 and 2028, APAC to occupy 53% market share ... PR ...","[{'ticker': 'MMM', 'relevance_score': '0.029292', 'ticker_sentiment_score': '0.014904', 'ticker_sentiment_label': 'Neutral'}]"
Should SPDR S&P Dividend ETF  ( SDY )  Be on Your Investing Radar?,20240318T102006,Style Box ETF report for ...,"[{'ticker': 'MMM', 'relevance_score': '0.119235', 'ticker_sentiment_score': '0.0608', 'ticker_sentiment_label': 'Neutral'}]"
A. O. Smith Appoints Stephen Shafer President and Chief Operating Officer - PR Newswire,20240318T120000,A. O. Smith Appoints Stephen Shafer President and Chief Operating Officer PR ...,"[{'ticker': 'MMM', 'relevance_score': '0.181819', 'ticker_sentiment_score': '0.240325', 'ticker_sentiment_label': 'Somewhat-Bullish'}]"
"DIY Home Improvement Market size to grow by USD 99.25 billion from 2022 to 2027, Market is fragmented due to the ... - PR Newswire",20240318T181200,"DIY Home Improvement Market size to grow by USD 99.25 billion from 2022 to 2027, Market is fragmented due to the ... PR ...","[{'ticker': 'MMM', 'relevance_score': '0.0362', 'ticker_sentiment_score': '0.122932', 'ticker_sentiment_label': 'Neutral'}]"
3M  ( NYSE:MMM )  Now Covered by StockNews.com,20240319T065443,"Investment analysts at StockNews.com started coverage on shares of 3M ( NYSE:MMM - Get Free Report ) in a research report issued on Tuesday. The firm set a ""buy"" rating on the conglomerate's stock. A number of other equities analysts also recently commented on the company.","[{'ticker': 'MMM', 'relevance_score': '0.102449', 'ticker_sentiment_score': '0.203198', 'ticker_sentiment_label': 'Somewhat-Bullish'}]"
Nvidia To Rally Around 10%? Here Are 10 Top Analyst Forecasts For Tuesday - NVIDIA  ( NASDAQ:NVDA ) ,20240319T123432,"Top Wall Street analysts changed their outlook on these top names. For a complete view of all analyst rating changes, including upgrades and downgrades, please see our analyst ratings page. JP Morgan cut the price target for Starbucks Corporation SBUX from $107 to $100.","[{'ticker': 'MMM', 'relevance_score': '0.16117', 'ticker_sentiment_score': '0.145832', 'ticker_sentiment_label': 'Neutral'}]"
Here's Why You Should Hold 3M  ( MMM )  in Your Portfolio Now,20240319T181400,"3M (MMM) gains from solid momentum in its Transportation and Electronics segment, buyouts and shareholder-friendly policies. Softness in the Consumer segment remains concerning.","[{'ticker': 'MMM', 'relevance_score': '0.299478', 'ticker_sentiment_score': '0.24255', 'ticker_sentiment_label': 'Somewhat-Bullish'}]"
"New CEO, Bottoming Cycle, And Spin-Off Fuel Optimism For 3M, Analyst Upgrades Stock - 3M  ( NYSE:MMM ) ",20240319T181426,Barclays analyst Julian Mitchell upgraded 3M Company MMM to Overweight from Equal Weight and raised the price target to $126 from $111. The analyst is bullish on the stock partly due to a smaller headwind from estimated / unannounced non-debt / environmental liabilities.,"[{'ticker': 'MMM', 'relevance_score': '0.479683', 'ticker_sentiment_score': '0.209752', 'ticker_sentiment_label': 'Somewhat-Bullish'}]"
Is 3M Stock Going to $126? 1 Wall Street Analyst Thinks So.,20240319T190522,A Barclays analyst is getting increasingly bullish on the turnaround prospects of this high-yield dividend stock.,"[{'ticker': 'MMM', 'relevance_score': '0.459624', 'ticker_sentiment_score': '-0.024857', 'ticker_sentiment_label': 'Neutral'}]"
