title,time_published,summary,ticker_sentiment
Global Power Tools market is projected to grow at a CAGR of 5.84% during 2023-2028 to be valued at USD 64.26 Billion by the end of forecast period: Bonafide Research,20230510T130900,"Clifton, New Jersey, May 10, 2023 ( GLOBE NEWSWIRE ) -- Power tools have been in high demand in recent years due to their increased demand, the growth of the construction industry, the expansion of the do-it-yourself ( DIY ) market, and the development of new technologies.","[{'ticker': 'MMM', 'relevance_score': '0.017281', 'ticker_sentiment_score': '0.101558', 'ticker_sentiment_label': 'Neutral'}]"
3M fires executive Michael Vale for 'inappropriate personal conduct',20230515T130700,Vale had worked at 3M for more than 30 years.,"[{'ticker': 'MMM', 'relevance_score': '0.459624', 'ticker_sentiment_score': '-0.460458', 'ticker_sentiment_label': 'Bearish'}]"
DuPont's stock bounces off 6-month low after Deutsche Bank says it's time to buy,20230515T160000,"DuPont's stock bounced off a 6-month low Monday after Deutsche Bank turned bullish, saying the stock was trading at a substantial discount to peers.","[{'ticker': 'MMM', 'relevance_score': '0.146025', 'ticker_sentiment_score': '-0.039782', 'ticker_sentiment_label': 'Neutral'}]"
3M Lets Go Of Executive For Inappropriate Personal Conduct - 3M  ( NYSE:MMM ) ,20230516T122248,"3M Co MMM has fired its Group President and Chief Business & Country Officer, Michael Vale, for inappropriate personal conduct and violation of company policy. 3M said Vale was terminated for cause, effective May 12, 2023. The company has initiated a search for Vale's successor.","[{'ticker': 'MMM', 'relevance_score': '0.661658', 'ticker_sentiment_score': '-0.613611', 'ticker_sentiment_label': 'Bearish'}]"
"Top Stories Tuesday, May 16: Former SVB CEO Blames Fed & Media Hype For Collapse, FTC Plans Lawsuit to Block Horizon Therapeutics $28B Takeover, Home Depot Lowers Annual Outlook - Amgen  ( NASDAQ:AMGN ) , Delta Air Lines  ( NYSE:DAL ) ",20230516T135640,"Greg Becker, the former CEO of SVB Financial Group, the parent company of Silicon Valley Bank, attributed the bank's collapse to a combination of factors, including rapid rate hikes by the Federal Reserve and negative sentiment amplified by social media.","[{'ticker': 'MMM', 'relevance_score': '0.084871', 'ticker_sentiment_score': '-0.32848', 'ticker_sentiment_label': 'Somewhat-Bearish'}]"
"3M  ( MMM ) , Svante Collaborate to Develop CO2 Removal Products",20230517T182900,The partnership between 3M (MMM) and Svante targets to develop solutions by utilizing parallel channel structured adsorbent technology for sale in the carbon dioxide removal industry.,"[{'ticker': 'MMM', 'relevance_score': '0.384397', 'ticker_sentiment_score': '0.171417', 'ticker_sentiment_label': 'Somewhat-Bullish'}]"
Corporate Tax Attorney Christine Lane Joins Crowell & Moring,20230518T133000,"WASHINGTON , May 18, 2023 /PRNewswire/ -- Christine K. Lane has joined Crowell & Moring as co-chair of the Tax Group, expanding the firm's ability to handle the U.S. federal tax aspects of complex business transactions, including domestic and cross-border mergers, acquisitions, joint ventures, ...","[{'ticker': 'MMM', 'relevance_score': '0.066414', 'ticker_sentiment_score': '0.070107', 'ticker_sentiment_label': 'Neutral'}]"
Dutch government to hold 3M liable for 'forever chemicals' damage,20230523T164001,"THE HAGUE, May 23 ( Reuters ) - The Dutch government said on Tuesday it would hold U.S. diversified manufacturer 3M Co ( MMM.N ) liable for polluting the Western Scheldt river with potentially harmful substances known as PFAS or ""forever chemicals"".","[{'ticker': 'MMM', 'relevance_score': '0.122269', 'ticker_sentiment_score': '-0.11379', 'ticker_sentiment_label': 'Neutral'}]"
3M's stock falls toward 10-year low after Dutch minister holds company liable for PFAS damage,20230524T190300,"3M's stock fell Wednesday toward a 10-year low, after investors were reminded that concerns over potential liabilities related to ""forever chemicals"" remained.","[{'ticker': 'MMM', 'relevance_score': '0.177802', 'ticker_sentiment_score': '-0.105051', 'ticker_sentiment_label': 'Neutral'}]"
'Post-it' maker 3M India's March-qtr profit rises on strong demand,20230530T091404,"BENGALURU, May 30 ( Reuters ) - 3M India ( TMIN.NS ) reported a 24% rise in quarterly profit on Tuesday, aided by robust demand in its transportation and electronics segment. Consolidated profit after tax rose to 1.36 billion rupees ( $16.4 million ) in the quarter ended March 31 from 1.11 ...","[{'ticker': 'MMM', 'relevance_score': '0.156461', 'ticker_sentiment_score': '0.110608', 'ticker_sentiment_label': 'Neutral'}]"
'Post-it' maker 3M India's Q4FY23 profit rises 24% on strong demand | The Financial Express,20230530T115523,'Post-it' maker 3M India's Q4FY23 profit rises 24% on strong demand The Financial Express ...,"[{'ticker': 'MMM', 'relevance_score': '0.173333', 'ticker_sentiment_score': '0.089021', 'ticker_sentiment_label': 'Neutral'}]"
3M  ( MMM )  to Invest $146M in Biotech Manufacturing Capabilities,20230601T140400,3M's (MMM) investment in biotech manufacturing is aimed at facility and equipment improvements and is expected to help in the creation of 60 full-time jobs in the European manufacturing facilities.,"[{'ticker': 'MMM', 'relevance_score': '0.210274', 'ticker_sentiment_score': '0.308954', 'ticker_sentiment_label': 'Somewhat-Bullish'}]"
MMM: 3 Dividend Stocks to Watch This Week,20230601T171857,"The chances of the economy heading into a recession are rising due to the high benchmark interest rate and an expected credit crunch due to tighter lending standards. In an uncertain macroeconomic environment, dividend stocks could help stabilize one's portfolio by providing stable dividend ...","[{'ticker': 'MMM', 'relevance_score': '0.234119', 'ticker_sentiment_score': '0.261574', 'ticker_sentiment_label': 'Somewhat-Bullish'}]"
"Transportation Management Systems  ( TMS )  Market Size to Grow by USD 3,704.52 million from 2022 to 2027, Increasing number of smart-connected devices to boost the market growth - Technavio",20230602T141500,Transportation Management Systems ( TMS ) Market Size to Grow by ... PR ...,"[{'ticker': 'MMM', 'relevance_score': '0.02668', 'ticker_sentiment_score': '-0.020878', 'ticker_sentiment_label': 'Neutral'}]"
"Top Research Reports for Exxon Mobil, AstraZeneca & Netflix",20230602T165300,"Today's Research Daily features new research reports on 16 major stocks, including Exxon Mobil Corporation (XOM), AstraZeneca PLC (AZN) and Netflix, Inc. (NFLX).","[{'ticker': 'MMM', 'relevance_score': '0.122269', 'ticker_sentiment_score': '0.101991', 'ticker_sentiment_label': 'Neutral'}]"
"Stock Market News for Jun 5, 2023",20230605T130100,Wall Street closed sharply higher on Friday buoyed by impressive jobs data for May.,"[{'ticker': 'MMM', 'relevance_score': '0.060694', 'ticker_sentiment_score': '0.086001', 'ticker_sentiment_label': 'Neutral'}]"
"3M  ( NYSE:MMM )  Lowered to ""Hold"" at StockNews.com",20230605T152230,StockNews.com lowered shares of 3M ( NYSE:MMM - Get Rating ) from a buy rating to a hold rating in a report published on Monday.,"[{'ticker': 'MMM', 'relevance_score': '0.24289', 'ticker_sentiment_score': '0.221383', 'ticker_sentiment_label': 'Somewhat-Bullish'}]"
5 Stocks in Dow ETF Leading Index to Best Day of 2023,20230605T160800,"The Dow Jones Industrial Average jumped 700 points on Jun 2, its best day of the year so far.","[{'ticker': 'MMM', 'relevance_score': '0.232439', 'ticker_sentiment_score': '0.10852', 'ticker_sentiment_label': 'Neutral'}]"
"Dow Stocks Like Microsoft, Apple, Disney, and Verizon Reveal Two Sides of the Market",20230606T130000,Many well-known stocks are missing out on the market's epic 2023 rally.,"[{'ticker': 'MMM', 'relevance_score': '0.034882', 'ticker_sentiment_score': '-0.045009', 'ticker_sentiment_label': 'Neutral'}]"
Should Invesco Dow Jones Industrial Average Dividend ETF  ( DJD )  Be on Your Investing Radar?,20230607T102008,Style Box ETF report for ...,"[{'ticker': 'MMM', 'relevance_score': '0.125789', 'ticker_sentiment_score': '0.069184', 'ticker_sentiment_label': 'Neutral'}]"
"Fund to Give $50,000 Grants to Black People From Minnesota and the Dakotas",20230607T185600,"In an effort to help Black people from Minnesota and the Dakotas build wealth, St. Paul-based Nexus Community Partners announced the US$50 million Open Road Fund earlier this week.","[{'ticker': 'MMM', 'relevance_score': '0.104228', 'ticker_sentiment_score': '-0.047657', 'ticker_sentiment_label': 'Neutral'}]"
"New York's Air Quality Worst On The Planet Wednesday: Outdoor Activities Canceled, Flights Delayed - Alpha Pro Tech  ( AMEX:APT ) , U.S. Global Jets ETF  ( ARCA:JETS ) ",20230607T201316,New York Gov. Kathy Hochul urged school districts to cancel outdoor activities Wednesday because of poor air quality driven by Canadian wildfires. Hochul noted that several districts had already canceled activities in an effort to keep students safe from the potentially harmful air.,"[{'ticker': 'MMM', 'relevance_score': '0.205807', 'ticker_sentiment_score': '0.0', 'ticker_sentiment_label': 'Neutral'}]"
Healthcare IT market size to grow by USD 168.86 billion from 2022 to 2027: The rising need for automation across departments to Drive Growth - Technavio,20230609T061500,Healthcare IT market size to grow by USD 168.86 billion from 2022 ... PR ...,"[{'ticker': 'MMM', 'relevance_score': '0.023327', 'ticker_sentiment_score': '0.038264', 'ticker_sentiment_label': 'Neutral'}]"
Is SPDR S&P Dividend ETF  ( SDY )  a Strong ETF Right Now?,20230609T102008,Smart Beta ETF report for ...,"[{'ticker': 'MMM', 'relevance_score': '0.11123', 'ticker_sentiment_score': '0.054793', 'ticker_sentiment_label': 'Neutral'}]"
"Digital Signage Market size to grow by USD 8,113.34 million from 2022 to 2027, Driven by the high growth of retail space - Technavio",20230609T223000,"Digital Signage Market size to grow by USD 8,113.34 million from ... PR ...","[{'ticker': 'MMM', 'relevance_score': '0.031864', 'ticker_sentiment_score': '0.027423', 'ticker_sentiment_label': 'Neutral'}]"
"Paints and coatings market size is set to grow by USD 28.41 billion from 2022 to 2027, Growth is driven by the growing real estate and construction industry - Technavio",20230614T230000,"Paints and coatings market size is set to grow by USD 28.41 billion from 2022 to 2027, Growth is driven by the growing ... PR ...","[{'ticker': 'MMM', 'relevance_score': '0.012664', 'ticker_sentiment_score': '0.0', 'ticker_sentiment_label': 'Neutral'}]"
"Industrial Coatings Market Size to grow by USD 18.74 billion from 2022 to 2027, The surging demand for waterborne coatings to boost the growth - Technavio",20230616T031500,"Industrial Coatings Market Size to grow by USD 18.74 billion from 2022 to 2027, The surging demand for waterborne ... PR ...","[{'ticker': 'MMM', 'relevance_score': '0.023743', 'ticker_sentiment_score': '0.050599', 'ticker_sentiment_label': 'Neutral'}]"
"Dental Equipment Market size is set to grow by USD 12,733.56 million from 2022 to 2027, Tax reimbursement to be a major market driver - Technavio",20230616T230000,"Dental Equipment Market size is set to grow by USD 12,733.56 million from 2022 to 2027, Tax reimbursement to be a ... PR ...","[{'ticker': 'MMM', 'relevance_score': '0.027892', 'ticker_sentiment_score': '0.0', 'ticker_sentiment_label': 'Neutral'}]"
Drywall Texture Market size in North America is to grow by USD 59.85 million from 2022 to 2027- The rising number of infrastructural and construction activities drives the market -Technavio,20230617T024500,Drywall Texture Market size in North America is to grow by USD 59.85 million from 2022 to 2027- The rising number of ... PR ...,"[{'ticker': 'MMM', 'relevance_score': '0.029363', 'ticker_sentiment_score': '-0.053376', 'ticker_sentiment_label': 'Neutral'}]"
"Hand Sanitizer Market size is set to grow by USD 1,656.28 million from 2022 to 2027, 3M Co., Arrow Solutions emerge as key contributors to growth - Technavio",20230619T184500,"Hand Sanitizer Market size is set to grow by USD 1,656.28 million from 2022 to 2027, 3M Co., Arrow Solutions emerge ... PR ...","[{'ticker': 'MMM', 'relevance_score': '0.02849', 'ticker_sentiment_score': '0.107617', 'ticker_sentiment_label': 'Neutral'}]"
"Digital Health Market Size to Grow by USD 563.59 billion from 2022 to 2027: A Descriptive Analysis of Vendor Assessment, and Market Dynamics - Technavio",20230622T164500,Digital Health Market Size to Grow by USD 563.59 billion from 2022 to 2027: A Descriptive Analysis of Vendor ... PR ...,"[{'ticker': 'MMM', 'relevance_score': '0.027382', 'ticker_sentiment_score': '0.039126', 'ticker_sentiment_label': 'Neutral'}]"
3M stock rallies after $10.3 billion 'forever chemical' settlement offered,20230622T221200,"3M Co. shares rallied after hours Thursday after the company said it would pay $10.3 billion to settle ""forever chemicals"" claims.","[{'ticker': 'MMM', 'relevance_score': '0.31482', 'ticker_sentiment_score': '-0.014124', 'ticker_sentiment_label': 'Neutral'}]"
3M reaches $10.3 billion settlement over contamination of water systems with 'forever chemicals',20230623T005949,"TRAVERSE CITY, Mich. ( AP ) - Chemical manufacturer 3M Co. will pay at least $10.3 billion to settle lawsuits over contamination of many U.S. public drinking water systems with potentially harmful compounds used in firefighting foam and a host of consumer products, the company said Thursday.","[{'ticker': 'MMM', 'relevance_score': '0.061003', 'ticker_sentiment_score': '-0.184073', 'ticker_sentiment_label': 'Somewhat-Bearish'}]"
3M Pays $10.3B To Settle PFAS Related Lawsuit - 3M  ( NYSE:MMM ) ,20230623T092223,"3M Co MMM reached a lawsuit settlement deal of $10.3 billion, payable over 13 years, with several U.S.-based public water suppliers ( PWS ) related to PFAS remediation.","[{'ticker': 'MMM', 'relevance_score': '0.479683', 'ticker_sentiment_score': '0.110803', 'ticker_sentiment_label': 'Neutral'}]"
Futures fall as Powell's hawkish stance sours market mood,20230623T095700,June 23 ( Reuters ) - U.S. stock index futures fell on Friday as investor sentiment remained damp due to the hawkish interest-rate outlook of Federal Reserve Chair Jerome Powell in his two-day congressional testimony.,"[{'ticker': 'MMM', 'relevance_score': '0.094762', 'ticker_sentiment_score': '0.13542', 'ticker_sentiment_label': 'Neutral'}]"
"Trupanion, IonQ, 3M And Other Big Stocks Moving Higher In Friday's Pre-Market Session - Beneficient  ( NASDAQ:BENF ) , GSK  ( NYSE:GSK ) ",20230623T103942,"Trupanion, Inc. TRUP shares surged 16.4% to $23.96 in pre-market trading after California and New York approved the company's requested rate increases. Beneficient BENF gained 12.1% to $4.37 in pre-market trading after dropping around 10% on Thursday. IonQ, Inc.","[{'ticker': 'MMM', 'relevance_score': '0.465196', 'ticker_sentiment_score': '-0.039258', 'ticker_sentiment_label': 'Neutral'}]"
3M  ( MMM )  Reaches $10.3B Settlement With PWS Related to PFAS,20230623T121100,3M (MMM) inks a tentative settlement with several U.S. PWS to provide up to $12.5 billion in funding over a period of 13 years for treating and testing the presence of PFAS in drinking water.,"[{'ticker': 'MMM', 'relevance_score': '0.263942', 'ticker_sentiment_score': '0.117194', 'ticker_sentiment_label': 'Neutral'}]"
"Top Stories Friday, June 23: Crypto Analyst Says Bitcoin Can Break $32K Level, Nikola Moves Forward With Test Road Trips Despite Weak Demand & Internal Conflict, Retailers' Subscriptions Under FTC Scrutiny - BlackRock  ( NYSE:BLK ) ",20230623T131444,"A pseudonymous crypto analyst on Thursday said that Bitcoin ( BTC/USD ) could soon break out of its ""indecision zone"" and push past a crucial resistance level of $32,000.","[{'ticker': 'MMM', 'relevance_score': '0.075161', 'ticker_sentiment_score': '-0.018308', 'ticker_sentiment_label': 'Neutral'}]"
Medical Aesthetics Market 2023-2027; Segmentation by geography type and end user. CAGR accelerating at 8.6% by 2027- Technavio,20230623T150000,Medical Aesthetics Market 2023-2027. Segmentation by geography type and end user. CAGR accelerating at 8.6% by ... PR ...,"[{'ticker': 'MMM', 'relevance_score': '0.03631', 'ticker_sentiment_score': '0.0', 'ticker_sentiment_label': 'Neutral'}]"
"Voice Speech Recognition Software Market size to grow by USD 14,859.93 million from 2022 to 2027; Growth opportunities led by 3M Co. and Alphabet Inc. - Technavio",20230624T031500,"Voice Speech Recognition Software Market size to grow by USD 14,859.93 million from 2022 to 2027. Growth ... PR ...","[{'ticker': 'MMM', 'relevance_score': '0.035397', 'ticker_sentiment_score': '0.088653', 'ticker_sentiment_label': 'Neutral'}]"
"Oral Care Market to grow by USD 11,147.45 million between 2022 to 2027; Growth opportunities led by 3M Co. and Amway Corp.| Technavio",20230625T053000,"Oral Care Market to grow by USD 11,147.45 million between 2022 to 2027. Growth opportunities led by 3M Co. and ... PR ...","[{'ticker': 'MMM', 'relevance_score': '0.026328', 'ticker_sentiment_score': '0.046503', 'ticker_sentiment_label': 'Neutral'}]"
Is Invesco Dow Jones Industrial Average Dividend ETF  ( DJD )  a Strong ETF Right Now?,20230626T102008,Smart Beta ETF report for ...,"[{'ticker': 'MMM', 'relevance_score': '0.115787', 'ticker_sentiment_score': '0.061204', 'ticker_sentiment_label': 'Neutral'}]"
"Ashland Board appoints Sergio Pedreiro, former chief operating officer, Revlon, as new director effective July 1, 2023",20230626T210000,Jay V. Ihlenfeld and Brendan M. Cummins plan exit in January 2024 Jay V. Ihlenfeld and Brendan M. Cummins plan exit in January ...,"[{'ticker': 'MMM', 'relevance_score': '0.109455', 'ticker_sentiment_score': '-0.004457', 'ticker_sentiment_label': 'Neutral'}]"
Here's Why You Should Add 3M  ( MMM )  to Your Portfolio Now,20230627T173900,"Strength across key end markets, pricing actions and cost-control measures augur well for 3M (MMM). The company's commitment to handsomely reward its shareholders is encouraging.","[{'ticker': 'MMM', 'relevance_score': '0.275867', 'ticker_sentiment_score': '0.543176', 'ticker_sentiment_label': 'Bullish'}]"
Pedro Pascal and World Bank's Ajay Banga among those named to Carnegie's 2023 Great Immigrants list,20230628T114200,"NEW YORK ( AP ) - World Bank President , Oscar winner , singer-songwriter Alanis Morissette and ""The Mandalorian"" star Pedro Pascal are on this year's announced Wednesday by the Carnegie Corporation of New York.","[{'ticker': 'MMM', 'relevance_score': '0.029989', 'ticker_sentiment_score': '0.059545', 'ticker_sentiment_label': 'Neutral'}]"
"Pedro Pascal, Ajay Banga among Carnegie's 2023 Great Immigrants list",20230628T145516,"World Bank President Ajay Banga, Oscar winner Ke Huy Quan, singer-songwriter Alanis Morissette and The Mandalorian star Pedro Pascal are on this year's Great Immigrants list announced on Wednesday by the Carnegie Corporation of New York.","[{'ticker': 'MMM', 'relevance_score': '0.03014', 'ticker_sentiment_score': '0.0', 'ticker_sentiment_label': 'Neutral'}]"
Microbiological Testing of Water Market size to grow at a CAGR of 7.3% from 2022 to 2027|Increasing cases of waterborne diseases to be a major market driver - Technavio,20230630T094500,Microbiological Testing of Water Market size to grow at a CAGR of 7.3% from 2022 to 2027|Increasing cases of ... PR ...,"[{'ticker': 'MMM', 'relevance_score': '0.027763', 'ticker_sentiment_score': '0.16492', 'ticker_sentiment_label': 'Somewhat-Bullish'}]"
Middle East Office Stationery Supplies and Services Market Size to grow by USD 725.04 million during 2022 to 2027 | Demand for customized office stationery to boost market growth - Technavio,20230701T014500,Middle East Office Stationery Supplies and Services Market Size to grow by USD 725.04 million during 2022 to 2027 ... PR ...,"[{'ticker': 'MMM', 'relevance_score': '0.027072', 'ticker_sentiment_score': '0.100307', 'ticker_sentiment_label': 'Neutral'}]"
Toothpaste Market size to grow by USD 3.99 billion from 2021 to 2026| Rising dental issues in the children and elderly population to drive the market - Technavio,20230703T234500,Toothpaste Market size to grow by USD 3.99 billion from 2021 to 2026| Rising dental issues in the children and elderly ... PR ...,"[{'ticker': 'MMM', 'relevance_score': '0.032781', 'ticker_sentiment_score': '0.148683', 'ticker_sentiment_label': 'Neutral'}]"
Knee Pad Market to grow at a CAGR of 4.54% from 2021 to 2026 | Marketing initiatives to be the primary market trend - Technavio,20230704T011500,Knee Pad Market to grow at a CAGR of 4.54% from 2021 to 2026 | Marketing initiatives to be the primary market trend ... PR ...,"[{'ticker': 'MMM', 'relevance_score': '0.027667', 'ticker_sentiment_score': '0.122488', 'ticker_sentiment_label': 'Neutral'}]"
The Thermometers Market will Accelerate at a CAGR of 8.86% from 2022 to 2027|Rising demand for highly efficient thermometers to boost market growth- Technavio,20230704T014500,The Thermometers Market will Accelerate at a CAGR of 8.86% from 2022 to 2027|Rising demand for highly efficient ... PR ...,"[{'ticker': 'MMM', 'relevance_score': '0.028903', 'ticker_sentiment_score': '0.096024', 'ticker_sentiment_label': 'Neutral'}]"
Disposable Medical Supplies Market to grow by USD 38.36 billion from 2022 to 2027|Growing need for disposable medical suppliers is one of the key drivers- Technavio,20230704T024500,Disposable Medical Supplies Market to grow by USD 38.36 billion from 2022 to 2027|Growing need for disposable ... PR ...,"[{'ticker': 'MMM', 'relevance_score': '0.023649', 'ticker_sentiment_score': '0.057945', 'ticker_sentiment_label': 'Neutral'}]"
Smart Glass Market Size to grow by USD 65.75 million from 2022 to 2027|Implementation of automation in the industrial sector to boost market growth - Technavio,20230704T041500,Smart Glass Market Size to grow by USD 65.75 million from 2022 to 2027|Implementation of automation in the ... PR ...,"[{'ticker': 'MMM', 'relevance_score': '0.027508', 'ticker_sentiment_score': '0.201799', 'ticker_sentiment_label': 'Somewhat-Bullish'}]"
"Pharma Packaging Films Market Revenue to Cross US$ 28.2 Bn by 2031 to Expand at a CAGR of 5.7% Says, Transparency Market Research",20230704T113000,"Wilmington, Delaware, United States, July 04, 2023 ( GLOBE NEWSWIRE ) -- Transparency Market Research Inc. - The global pharma packaging films market was valued at US$ 16.7 Bn in 2022. It is projected to grow at a CAGR of 5.7% from 2023 to 2031 and reach US$ 28.2 Bn by 2031.","[{'ticker': 'MMM', 'relevance_score': '0.049629', 'ticker_sentiment_score': '0.055437', 'ticker_sentiment_label': 'Neutral'}]"
Intelligent Transport System  ( ITS )  Market to grow at a CAGR of 8.49% from 2022 to 2027|Increased use of the meta-intelligence concept in transport systems is one of the primary trends - Technavio,20230706T101500,Intelligent Transport System ( ITS ) Market to grow at a CAGR of 8.49% from 2022 to 2027|Increased use of the meta ... PR ...,"[{'ticker': 'MMM', 'relevance_score': '0.027763', 'ticker_sentiment_score': '0.09974', 'ticker_sentiment_label': 'Neutral'}]"
Acoustic Insulation Market will accelerate at a CAGR of 3.99% from 2022 to 2027 | Increasing concerns over noise pollution to boost market growth- Technavio,20230707T164500,Acoustic Insulation Market will accelerate at a CAGR of 3.99% from 2022 to 2027 | Increasing concerns over noise ... PR ...,"[{'ticker': 'MMM', 'relevance_score': '0.025901', 'ticker_sentiment_score': '0.121406', 'ticker_sentiment_label': 'Neutral'}]"
Medical Document Management Systems Market to grow by USD 412.45 million from 2022 to 2027|Increased efficiency and productivity in MDMS to boost the market - Technavio,20230711T031500,Medical Document Management Systems Market to grow by USD 412.45 million from 2022 to 2027|Increased ... PR ...,"[{'ticker': 'MMM', 'relevance_score': '0.029113', 'ticker_sentiment_score': '0.05501', 'ticker_sentiment_label': 'Neutral'}]"
Should SPDR S&P Dividend ETF  ( SDY )  Be on Your Investing Radar?,20230711T102007,Style Box ETF report for ...,"[{'ticker': 'MMM', 'relevance_score': '0.11983', 'ticker_sentiment_score': '0.060926', 'ticker_sentiment_label': 'Neutral'}]"
3M stock jumps after BofA backs away from bearish call,20230711T160400,3M's stock jumped Tuesday after BofA Securities recommended investors stop selling ahead of earnings.,"[{'ticker': 'MMM', 'relevance_score': '0.184598', 'ticker_sentiment_score': '0.106498', 'ticker_sentiment_label': 'Neutral'}]"
"Indoor Air Quality Meters Market will accelerate at a CAGR of 8.5% from 2022 to 2027|3M Co., Aeroqual Ltd., Airthings ASA, to emerge as major players- Technavio",20230712T093000,"Indoor Air Quality Meters Market will accelerate at a CAGR of 8.5% from 2022 to 2027|3M Co., Aeroqual Ltd., Airthings ... PR ...","[{'ticker': 'MMM', 'relevance_score': '0.032602', 'ticker_sentiment_score': '0.057111', 'ticker_sentiment_label': 'Neutral'}]"
Salesforce's stock gets a lift as company announces rare price increases,20230712T115800,Shares of Salesforce were getting a boost in Tuesday morning action after the company announced what it said were its first price increases in seven years.,"[{'ticker': 'MMM', 'relevance_score': '0.215894', 'ticker_sentiment_score': '0.188359', 'ticker_sentiment_label': 'Somewhat-Bullish'}]"
"Healthcare IT Market to grow at a CAGR of 10.89% from 2022 to 2027: M Co., Allscripts Healthcare Solutions Inc., Athenahealth Inc. to emerge as key players of the market- Technavio",20230713T034500,"Healthcare IT Market to grow at a CAGR of 10.89% from 2022 to 2027: M Co., Allscripts Healthcare Solutions Inc ... PR ...","[{'ticker': 'MMM', 'relevance_score': '0.038843', 'ticker_sentiment_score': '0.08881', 'ticker_sentiment_label': 'Neutral'}]"
