title,time_published,summary,ticker_sentiment
Is It Time to Buy the Dow Jones' 3 Worst-Performing February Stocks?,20220304T121500,"Even some of the market's most reliable, stable names have been swept up in the selling floodwaters.","[{'ticker': 'MMM', 'relevance_score': '0.205588', 'ticker_sentiment_score': '-0.156928', 'ticker_sentiment_label': 'Somewhat-Bearish'}]"
"Stock Market Today: Dow Jones, S&P 500 Tumble On Ukraine Nuclear Plant Worries, C3.ai  ( AI )  Dips On Downgrade",20220304T151933,"Markets are down today as Ukraine concerns overshadow strong jobs report.
The post Stock Market Today: Dow Jones, S&P 500 Tumble On Ukraine Nuclear Plant Worries, C3.ai  ( AI )  Dips On Downgrade appeared first on Stock Market News, Quotes, Charts and Financial Information | StockMarket.com.","[{'ticker': 'MMM', 'relevance_score': '0.078188', 'ticker_sentiment_score': '-0.039188', 'ticker_sentiment_label': 'Neutral'}]"
"Stock Market Today: Dow Jones, S&P 500 Falters As Russia-Ukraine War Drags On; BBBY Stock Soars As Ryan Cohen Takes Stake",20220307T151451,"Markets open lower today as investors are battered by rising inflation and economic fallout from Russia's war on Ukraine.
The post Stock Market Today: Dow Jones, S&P 500 Falters As Russia-Ukraine War Drags On; BBBY Stock Soars As Ryan Cohen Takes Stake appeared first on Stock Market News, Quotes, Ch","[{'ticker': 'MMM', 'relevance_score': '0.08395', 'ticker_sentiment_score': '-0.01955', 'ticker_sentiment_label': 'Neutral'}]"
Hospital Supplies Market in the US 2022-2026 | Increasing Adoption of Surgical Procedures to Boost Growth | Technavio,20220307T214500,"The market is fragmented, and the degree of fragmentation will accelerate during the forecast period. Product recall, disruption in the supply chain of hospital supplies, and stringent regulatory policies will challenge the growth of the market participants. To make the most of the opportunities, market vendors should focus more on the growth prospects in the fast-growing segments, while maintaining their positions in the slow-growing segments.","[{'ticker': 'MMM', 'relevance_score': '0.061096', 'ticker_sentiment_score': '0.004583', 'ticker_sentiment_label': 'Neutral'}]"
"Stock Market Today: Dow Jones, S&P 500 Ticks Lower On Potential U.S. Oil Ban; Dick's Sporting Goods  ( DKS )  Up On Earnings Beat",20220308T151730,"Markets edged lower today as the U.S. looks set to ban Russian oil.
The post Stock Market Today: Dow Jones, S&P 500 Ticks Lower On Potential U.S. Oil Ban; Dick's Sporting Goods  ( DKS )  Up On Earnings Beat appeared first on Stock Market News, Quotes, Charts and Financial Information | StockMarket.c","[{'ticker': 'MMM', 'relevance_score': '0.088001', 'ticker_sentiment_score': '9.7e-05', 'ticker_sentiment_label': 'Neutral'}]"
"The Abrasives Market Is Expected To Reach $56 Billion By 2026, With The Rise Of Electric Vehicles As Per The Business Research Company's Abrasives Market Global Market Report 2022",20220308T163000,"LONDON, March  08, 2022   ( GLOBE NEWSWIRE )  -- According to The Business Research Company's research report on the abrasives market, the growing electrical vehicle  ( EV )  industry is expected to propel the growth of the abrasives market. An electric vehicle is one that uses an electric motor and","[{'ticker': 'MMM', 'relevance_score': '0.031294', 'ticker_sentiment_score': '0.004186', 'ticker_sentiment_label': 'Neutral'}]"
5 Reasons 3M Stock Fell 10.5% in February and Is Still Sinking,20220308T180855,"3M might be facing challenges, but its stock looks cheap now and could bottom out.","[{'ticker': 'MMM', 'relevance_score': '0.787823', 'ticker_sentiment_score': '-0.365333', 'ticker_sentiment_label': 'Bearish'}]"
3M  ( MMM )  Gains As Market Dips: What You Should Know,20220308T225016,"3M (MMM) closed at $145.40 in the latest trading session, marking a +1.48% move from the prior day.","[{'ticker': 'MMM', 'relevance_score': '0.587118', 'ticker_sentiment_score': '0.015418', 'ticker_sentiment_label': 'Neutral'}]"
USD 3.99 billion growth in Medical Tapes and Bandages Market | Hospitals segment to account for maximum growth | Technavio,20220309T090000,to understand the scope of the report.,"[{'ticker': 'MMM', 'relevance_score': '0.054077', 'ticker_sentiment_score': '0.202957', 'ticker_sentiment_label': 'Somewhat-Bullish'}]"
"Stock Market Today: Dow Jones, S&P 500 Rebound After A Volatile Week; Bumble  ( BMBL )  Stock Soars On Optimistic Forecasts",20220309T151133,"Markets posted sharp gains amid optimism for a diplomatic solution to the Russian invasion of Ukraine
The post Stock Market Today: Dow Jones, S&P 500 Rebound After A Volatile Week; Bumble  ( BMBL )  Stock Soars On Optimistic Forecasts appeared first on Stock Market News, Quotes, Charts and Financial","[{'ticker': 'MMM', 'relevance_score': '0.082266', 'ticker_sentiment_score': '0.016221', 'ticker_sentiment_label': 'Neutral'}]"
"Stock Market Today: Dow Jones, S&P 500 Tumble As Latest Russia-Ukraine Talks Fail; Amazon  ( AMZN )  Soars On Stock Split",20220310T151005,"Markets are down amidst red-hot inflation data and no progress on Russia-Ukraine ceasefire talks 
The post Stock Market Today: Dow Jones, S&P 500 Tumble As Latest Russia-Ukraine Talks Fail; Amazon  ( AMZN )  Soars On Stock Split appeared first on Stock Market News, Quotes, Charts and Financial Infor","[{'ticker': 'MMM', 'relevance_score': '0.073513', 'ticker_sentiment_score': '-0.080158', 'ticker_sentiment_label': 'Neutral'}]"
"Stock Market Today: Dow Jones, S&P 500 Opens Higher On Hopes In Russia-Ukraine Talks; Ford  ( F )  Partners With PG&E On Electric F-150 Powering Homes",20220311T150826,"Hopes of progress in Russia-Ukraine ceasefire talks push the markets higher today.
The post Stock Market Today: Dow Jones, S&P 500 Opens Higher On Hopes In Russia-Ukraine Talks; Ford  ( F )  Partners With PG&E On Electric F-150 Powering Homes appeared first on Stock Market News, Quotes, Charts and F","[{'ticker': 'MMM', 'relevance_score': '0.079841', 'ticker_sentiment_score': '0.007534', 'ticker_sentiment_label': 'Neutral'}]"
Global Residential Air Purification Equipment Market to Reach $12.2 Billion by 2026,20220311T152000,• Access to our digital archives and MarketGlass Research Platform,"[{'ticker': 'MMM', 'relevance_score': '0.031163', 'ticker_sentiment_score': '0.001879', 'ticker_sentiment_label': 'Neutral'}]"
Global Cathode Materials Market to Reach $20.7 Billion by 2026,20220311T162100,• Access to our digital archives and MarketGlass Research Platform,"[{'ticker': 'MMM', 'relevance_score': '0.032199', 'ticker_sentiment_score': '0.000797', 'ticker_sentiment_label': 'Neutral'}]"
Global Industry Analysts Predicts the World ECG Cable and ECG Lead Wires Market to Reach $2 Billion by 2026,20220311T165500,• Access to our digital archives and MarketGlass Research Platform,"[{'ticker': 'MMM', 'relevance_score': '0.031241', 'ticker_sentiment_score': '0.000927', 'ticker_sentiment_label': 'Neutral'}]"
This Industrial Company Is A Better Bet Over General Electric Stock,20220314T093031,"We believe that 3M stock currently is an attractive pick over General Electric stock, despite 3M's comparatively higher valuation. MMM stock trades at 2.3x trailing revenues, compared to 1.3x for GE stock. We believe that this valuation gap is justified, given 3M's superior revenue growth and...","[{'ticker': 'MMM', 'relevance_score': '0.752304', 'ticker_sentiment_score': '0.065252', 'ticker_sentiment_label': 'Neutral'}]"
"Stock Market Today: Dow Jones, S&P 500 Opens Higher Ahead Of Fed's Policy Decision; Ford  ( F )  Unveils Its Plans For Europe",20220314T141854,"The markets begin the week by recovering some of its recent losses amid an ongoing war in Ukraine.
The post Stock Market Today: Dow Jones, S&P 500 Opens Higher Ahead Of Fed's Policy Decision; Ford  ( F )  Unveils Its Plans For Europe appeared first on Stock Market News, Quotes, Charts and Financial ","[{'ticker': 'MMM', 'relevance_score': '0.08282', 'ticker_sentiment_score': '0.008197', 'ticker_sentiment_label': 'Neutral'}]"
Tech Stocks Nailed Again Amid Surging 10-Year Yield,20220314T180720,Dow Jones Holds Steady Amid Another Tech Sell-Off; Surging 10-Year Yield Lifts These Financial Stocks Investor's Business Daily,"[{'ticker': 'MMM', 'relevance_score': '0.213925', 'ticker_sentiment_score': '-0.95453', 'ticker_sentiment_label': 'Bearish'}]"
3M  ( MMM )  Gains As Market Dips: What You Should Know,20220314T215018,"3M (MMM) closed the most recent trading day at $143.48, moving +1.79% from the previous trading session.","[{'ticker': 'MMM', 'relevance_score': '0.593553', 'ticker_sentiment_score': '0.021752', 'ticker_sentiment_label': 'Neutral'}]"
Jefferies Cuts 3M's Price Target By 13%,20220315T131029,"3M Co  ( NYSE: MMM )  price target has been lowered to $161  ( an upside of 12.2% )  from $186 by Jefferies analyst Laurence Alexander.
The analyst reduced his 2022 and 2023 estimates citing end-market headwinds and cost inflation due to the recent increase in oil ...Full story available on Benzinga","[{'ticker': 'MMM', 'relevance_score': '0.922823', 'ticker_sentiment_score': '-0.077817', 'ticker_sentiment_label': 'Neutral'}]"
"Stock Market Today: Dow Jones, S&P 500 Opens Higher As Oil Prices Fall; Gitlab  ( GTLB )  Up On Earnings Beat",20220315T141439,"The markets open higher as oil prices fall and lighter than expected inflation report.
The post Stock Market Today: Dow Jones, S&P 500 Opens Higher As Oil Prices Fall; Gitlab  ( GTLB )  Up On Earnings Beat appeared first on Stock Market News, Quotes, Charts and Financial Information | StockMarket.co","[{'ticker': 'MMM', 'relevance_score': '0.080162', 'ticker_sentiment_score': '0.012477', 'ticker_sentiment_label': 'Neutral'}]"
The Quantum Dot Market Growth Sees Rate of 25% With The Rising Demand For Smart TVs And Mobile Phones As Per The Business Research Company's Quantum Dot Global Market Report 2022,20220315T153000,"LONDON, March  15, 2022   ( GLOBE NEWSWIRE )  -- According to The Business Research Company's research report on the quantum dot market, the growing demand for smart televisions and mobile phones is expected to propel the growth of the quantum dot market. A smart television is an internet-based TV s","[{'ticker': 'MMM', 'relevance_score': '0.370088', 'ticker_sentiment_score': '0.005536', 'ticker_sentiment_label': 'Neutral'}]"
"Stock Market Today: Dow Jones, S&P 500 Up Today; Chinese Tech Stocks Open Higher On China Reassurance",20220316T140757,"Markets open higher ahead of the Federal Reserve's key interest rate decision.
The post Stock Market Today: Dow Jones, S&P 500 Up Today; Chinese Tech Stocks Open Higher On China Reassurance appeared first on Stock Market News, Quotes, Charts and Financial Information | StockMarket.com.","[{'ticker': 'MMM', 'relevance_score': '0.084916', 'ticker_sentiment_score': '0.021002', 'ticker_sentiment_label': 'Neutral'}]"
MMM: Dow vs. 3M: Which High-Yield Dow Jones Stock is a Better Buy?,20220317T164054,"3M Company  (  MMM  )  in St. Paul, Minn., is a diversified global manufacturer, technology innovator, and marketer of various products and services. The company operates through the Safety and Industrial; Transportation and Electronics; Health Care; and Consumer segments. In comparison, Midland, Mich.-based Dow Inc.  (  DOW  )  is the holding company for The Dow Chemical Company and its subsidiaries. Its plastics, industrial intermediates, coatings, and silicones businesses deliver a range of science-based products and solutions to its customers in various market segments that include packaging, infrastructure, mobility, and consumer care. It operates through Packaging & Specialty Plastics; Industrial Intermediates & Infrastructure; and Performance Materials & Coatings.","[{'ticker': 'MMM', 'relevance_score': '0.46066', 'ticker_sentiment_score': '0.133051', 'ticker_sentiment_label': 'Neutral'}]"
Should You Buy 3M Stock At $145?,20220318T093000,"After nearly a 20% fall year-to-date, at the current price of around $144 per share, we believe 3M stock is undervalued. MMM stock fell from about $180 in early January to $144 now. The -20% move for MMM so far this year compares with -11% returns for the broader S&P500 index...","[{'ticker': 'MMM', 'relevance_score': '0.901593', 'ticker_sentiment_score': '-0.110928', 'ticker_sentiment_label': 'Neutral'}]"
Honeywell's  ( HON )  Forge Solution Selected by Lincoln Harris,20220318T130000,Honeywell's (HON) Forge solution will enable Lincoln Harris to detect building maintenance issues and improve occupants' experience.,"[{'ticker': 'MMM', 'relevance_score': '0.285082', 'ticker_sentiment_score': '0.248901', 'ticker_sentiment_label': 'Somewhat-Bullish'}]"
Looking Into 3M Company's Recent Short Interest,20220318T190218,"3M Company's  ( NYSE:MMM )  short percent of float has risen 6.36% since its last report. The company recently reported that it has 10.49 million shares sold short, which is 1.84% of all regular shares that are available for trading. Based on its trading volume, it would take traders 3.5 days to cov","[{'ticker': 'MMM', 'relevance_score': '0.348919', 'ticker_sentiment_score': '-0.241053', 'ticker_sentiment_label': 'Somewhat-Bearish'}]"
5 Business Stages Every Investor Should Know,20220319T121500,Finding out where a company is in its business life cycle can help you achieve smarter valuations.,"[{'ticker': 'MMM', 'relevance_score': '0.134214', 'ticker_sentiment_score': '0.03554', 'ticker_sentiment_label': 'Neutral'}]"
Global Ag Paste Market to Reach $3.5 Billion by 2026,20220321T142000,• Access to our digital archives and MarketGlass Research Platform,"[{'ticker': 'MMM', 'relevance_score': '0.037341', 'ticker_sentiment_score': '0.00104', 'ticker_sentiment_label': 'Neutral'}]"
3M  ( MMM )  Gains As Market Dips: What You Should Know,20220321T220021,"3M (MMM) closed the most recent trading day at $148.58, moving +0.18% from the previous trading session.","[{'ticker': 'MMM', 'relevance_score': '0.518414', 'ticker_sentiment_score': '0.026902', 'ticker_sentiment_label': 'Neutral'}]"
3M  ( MMM )  Gains But Lags Market: What You Should Know,20220322T215019,"In the latest trading session, 3M (MMM) closed at $149.94, marking a +0.92% move from the previous day.","[{'ticker': 'MMM', 'relevance_score': '0.637345', 'ticker_sentiment_score': '0.028262', 'ticker_sentiment_label': 'Neutral'}]"
"Valued to be $36.7 Billion by 2026, Hand Sanitizers Slated for Robust Growth Worldwide",20220325T185500,• Access to our digital archives and MarketGlass Research Platform,"[{'ticker': 'MMM', 'relevance_score': '0.032925', 'ticker_sentiment_score': '0.002135', 'ticker_sentiment_label': 'Neutral'}]"
"New Analysis from Global Industry Analysts Reveals Steady Growth for Gas Detection Equipment, with the Market to Reach $3.4 Billion Worldwide by 2026",20220325T191500,• Access to our digital archives and MarketGlass Research Platform,"[{'ticker': 'MMM', 'relevance_score': '0.026731', 'ticker_sentiment_score': '0.001781', 'ticker_sentiment_label': 'Neutral'}]"
Global Radiation Cured Products Market to Reach $8.8 Billion by 2025,20220325T200500,• Access to our digital archives and MarketGlass Research Platform,"[{'ticker': 'MMM', 'relevance_score': '0.036069', 'ticker_sentiment_score': '0.001233', 'ticker_sentiment_label': 'Neutral'}]"
3 Dividend Aristocrats That Get More Attractive as They Fall,20220326T143500,"When you can feel pretty confident about the future of a company's quarterly payouts, sliding share prices represent opportunities to earn higher yields.","[{'ticker': 'MMM', 'relevance_score': '0.237939', 'ticker_sentiment_score': '-0.155782', 'ticker_sentiment_label': 'Somewhat-Bearish'}]"
3 Top Dividend Kings to Buy for the Long Haul,20220326T150700,"If you want consistent and stable income, you cannot go wrong with these three stocks.","[{'ticker': 'MMM', 'relevance_score': '0.1871', 'ticker_sentiment_score': '0.326204', 'ticker_sentiment_label': 'Somewhat-Bullish'}]"
Air Quality Monitoring System Market Size [2022-2028] worth USD 8.33 Billion | Exhibit a CAGR of 7.5%,20220328T132301,"Pune, India, March  28, 2022   ( GLOBE NEWSWIRE )  -- Air Quality Monitoring System market size is projected to reach to USD 8.33 billion in 2028, at a CAGR of 7.5%. The global Air Quality Monitoring System market size was USD 4.86 billion in 2020. The global air quality monitoring system market is ","[{'ticker': 'MMM', 'relevance_score': '0.047787', 'ticker_sentiment_score': '0.002227', 'ticker_sentiment_label': 'Neutral'}]"
3M  ( MMM )  Stock Sinks As Market Gains: What You Should Know,20220328T220021,"3M (MMM) closed at $149.47 in the latest trading session, marking a -0.66% move from the prior day.","[{'ticker': 'MMM', 'relevance_score': '0.598786', 'ticker_sentiment_score': '0.005157', 'ticker_sentiment_label': 'Neutral'}]"
U.S. Water and Wastewater Treatment Technologies Market Worth $24.63 Billion by 2029 - Exclusive Report by Meticulous Research®,20220329T140000,"Redding,  California, March  29, 2022   ( GLOBE NEWSWIRE )  -- According to a new market research report titled, ""U.S. Water and Wastewater Treatment Technologies Market by Treatment Technologies Type  ( Membrane Separation & Filtration, Sludge Management Technology, Activated Sludge, Clarification ","[{'ticker': 'MMM', 'relevance_score': '0.024744', 'ticker_sentiment_score': '0.001671', 'ticker_sentiment_label': 'Neutral'}]"
3M  ( MMM )  Outpaces Stock Market Gains: What You Should Know,20220329T215020,"3M (MMM) closed the most recent trading day at $152.08, moving +1.75% from the previous trading session.","[{'ticker': 'MMM', 'relevance_score': '0.578304', 'ticker_sentiment_score': '0.007781', 'ticker_sentiment_label': 'Neutral'}]"
"3M Expects To Record Charge In Q1 Related To Remediation At Zwijndrecht, Belgium",20220330T182510,"3M Co  ( NYSE: MMM )  invests an additional €150 million to proactively advance remedial actions for the Zwijndrecht community to address legacy manufacturing and disposal of per- and polyfluoroalkyl substances  ( PFAS ) .
The investment adds to ...Full story available on Benzinga.com","[{'ticker': 'MMM', 'relevance_score': '0.925854', 'ticker_sentiment_score': '0.021585', 'ticker_sentiment_label': 'Neutral'}]"
"Custom Procedure Packs Market: 39% of Growth to Originate from North America | By Type  ( single-use and reusable )  and Geography | Market Size, Share, Industry Analysis, and Forecast, 2022-2026",20220331T103000,39% of the market's growth will originate from North America during the forecast period. US and Canada are the key markets for custom procedure packs market in North America. Market growth in this region will be slower than the growth of the market in Asia. The growing healthcare sector in the region will facilitate the custom procedure packs market growth in North America over the forecast period.,"[{'ticker': 'MMM', 'relevance_score': '0.033038', 'ticker_sentiment_score': '0.012346', 'ticker_sentiment_label': 'Neutral'}]"
Why These 3 Dividend Aristocrats Are Good Buys During a Bear Market,20220331T143926,Let dividends reward you even when stock prices are dropping.,"[{'ticker': 'MMM', 'relevance_score': '0.106588', 'ticker_sentiment_score': '0.189808', 'ticker_sentiment_label': 'Somewhat-Bullish'}]"
Membrane Chromatography Market is Expected to Grow at a CAGR of 18.0% | MDC Research,20220331T184041,"Pune, March  31, 2022   ( GLOBE NEWSWIRE )  -- Chromatography is a laboratory technique that focuses on determining the differences in the physical and chemical properties of various substances. Membrane Chromatography uses microfiltration membrane with functional ligand or antigens linked to the in","[{'ticker': 'MMM', 'relevance_score': '0.029761', 'ticker_sentiment_score': '0.002515', 'ticker_sentiment_label': 'Neutral'}]"
Is 3M the Next Big Company to Break Up? Here's What It Could Look Like.,20220331T194100,Here's What a 3M Breakup Could Look Like Barron's,"[{'ticker': 'MMM', 'relevance_score': '0.919462', 'ticker_sentiment_score': '-0.109176', 'ticker_sentiment_label': 'Neutral'}]"
"Global Preformed Firestop Devices Market to 2030 - by Type, Application, End-user and Region",20220331T221500,"DUBLIN, March 31, 2022 /PRNewswire/ -- The ""Preformed Firestop Devices Market by Type, Application and End User: Global Opportunity Analysis and Industry Forecast, 2021-2030"" report has been added to ResearchAndMarkets.com's offering.","[{'ticker': 'MMM', 'relevance_score': '0.032638', 'ticker_sentiment_score': '0.001046', 'ticker_sentiment_label': 'Neutral'}]"
The Worldwide Life Science Filtration Industry is Expected to Reach $23.6 Billion by 2028,20220401T094500,"DUBLIN, April 1, 2022 /PRNewswire/ -- The ""Life Science Filtration Global Market - Forecast to 2028"" report has been added to ResearchAndMarkets.com's offering.","[{'ticker': 'MMM', 'relevance_score': '0.032713', 'ticker_sentiment_score': '0.002018', 'ticker_sentiment_label': 'Neutral'}]"
Got $500? 3 High-Yield Dividend Stocks to Buy in April,20220401T100000,Boost your passive income stream with this 3.7%-yielding basket of dividend stocks.,"[{'ticker': 'MMM', 'relevance_score': '0.394617', 'ticker_sentiment_score': '0.038976', 'ticker_sentiment_label': 'Neutral'}]"
Market Sell-Off: Is 3M Stock a Buy Now?,20220401T124500,"The dip in the share price and the stock's high dividend yield is attracting investors, but is it worth buying?","[{'ticker': 'MMM', 'relevance_score': '0.478227', 'ticker_sentiment_score': '-0.14302', 'ticker_sentiment_label': 'Neutral'}]"
3 Reasons to Buy Dividend Aristocrats for Your Retirement Account,20220402T115500,These companies have withstood the test of time.,"[{'ticker': 'MMM', 'relevance_score': '0.193413', 'ticker_sentiment_score': '-0.199335', 'ticker_sentiment_label': 'Somewhat-Bearish'}]"
Apple Analyst Doesn't See 3M Coolant Plant Shutdown In Belgium Affecting Chip Supply,20220404T065521,"Ming-Chi Kuo, a noted Apple Inc  ( NASDAQ: AAPL )  analyst, said the impact on semiconductor supply from the shutdown of 3M Company's  ( NYSE: MMM )  coolant plant in Belgium ""could be almost ignored.""
Kuo's comments came after media reports indicated that 3M's Belgium semiconductor coolant plant - ","[{'ticker': 'MMM', 'relevance_score': '0.721785', 'ticker_sentiment_score': '-0.06531', 'ticker_sentiment_label': 'Neutral'}]"
"Morning Brief: Top Stories Dominating Financial Media on Monday, April 4",20220404T115629,"Reuters
ExxonMobil Ditches Russia Following Western Sanctions
Exxon Mobil Corp  ( NYSE: XOM )  suspended its liquefied natural gas project in Russia's Far East following Western sanctions.
Exxon would pull out of managing extensive oil and gas production facilities on Sakhalin Island in Russia's Far","[{'ticker': 'MMM', 'relevance_score': '0.067149', 'ticker_sentiment_score': '-0.233647', 'ticker_sentiment_label': 'Somewhat-Bearish'}]"
Why Nvidia Stock Popped on Monday,20220404T205800,Trouble at a 3M plant has the potential to raise semiconductor prices even more.,"[{'ticker': 'MMM', 'relevance_score': '0.1331', 'ticker_sentiment_score': '-0.883234', 'ticker_sentiment_label': 'Bearish'}]"
3M  ( MMM )  Stock Sinks As Market Gains: What You Should Know,20220404T220017,"3M (MMM) closed the most recent trading day at $149.53, moving -0.11% from the previous trading session.","[{'ticker': 'MMM', 'relevance_score': '0.633961', 'ticker_sentiment_score': '0.020854', 'ticker_sentiment_label': 'Neutral'}]"
Adhesives and Sealants Market Experiencing Significant Growth Opportunities | Here's Why - MDC Research,20220405T140141,"Pune, April  05, 2022   ( GLOBE NEWSWIRE )  -- Adhesives & Sealants Market by type/solution, service, organization size, end-use verticals, and Region - Global Adhesives & Sealants Market Forecast to 2030, published by Market Data Centre, The Adhesives & Sealants Market is projected to grow at a sol","[{'ticker': 'MMM', 'relevance_score': '0.027712', 'ticker_sentiment_score': '0.043018', 'ticker_sentiment_label': 'Neutral'}]"
Wound Dressings Market Post-Pandemic Survey Analysis Report | MDC Research,20220405T141222,"Pune, April  05, 2022   ( GLOBE NEWSWIRE )  -- The global wound dressings market is driven by technological  advancements in the wound treatment arena coupled with increasing  geriatric population. Increasing patient awareness and health care  expenditure, rising prevalence of chronic wounds, namely","[{'ticker': 'MMM', 'relevance_score': '0.098255', 'ticker_sentiment_score': '0.002952', 'ticker_sentiment_label': 'Neutral'}]"
Peering Into 3M Company's Recent Short Interest,20220405T171113,"3M Company's  ( NYSE:MMM )  short percent of float has risen 10.33% since its last report. The company recently reported that it has 11.57 million shares sold short, which is 2.03% of all regular shares that are available for trading. Based on its trading volume, it would take traders 3.7 days to co","[{'ticker': 'MMM', 'relevance_score': '0.348756', 'ticker_sentiment_score': '-0.197166', 'ticker_sentiment_label': 'Somewhat-Bearish'}]"
3M  ( MMM )  Stock Moves -0.42%: What You Should Know,20220405T215020,"3M (MMM) closed at $148.90 in the latest trading session, marking a -0.42% move from the prior day.","[{'ticker': 'MMM', 'relevance_score': '0.586481', 'ticker_sentiment_score': '0.003267', 'ticker_sentiment_label': 'Neutral'}]"
