title,time_published,summary,ticker_sentiment
"United Airlines To Rally Around 37%? Here Are 10 Other Analyst Forecasts For Monday - Burlington Stores  ( NYSE:BURL ) , Albemarle  ( NYSE:ALB ) ",20230626T130022,"Raymond James boosted the price target for RadNet, Inc. RDNT from $35 to $40. Raymond James analyst John Ransom maintained an Outperform rating. RadNet shares rose 2.1% to close at $33.44 on Friday. Keybanc raised the price target for Albemarle Corporation ALB from $270 to $291.","[{'ticker': 'SHW', 'relevance_score': '0.28008', 'ticker_sentiment_score': '0.477407', 'ticker_sentiment_label': 'Bullish'}]"
Is Invesco S&P 500 Equal Weight Materials ETF  ( RSPM )  a Strong ETF Right Now?,20230628T102009,Smart Beta ETF report for ...,"[{'ticker': 'SHW', 'relevance_score': '0.121037', 'ticker_sentiment_score': '0.05891', 'ticker_sentiment_label': 'Neutral'}]"
"Concrete Densifier Market to Garner $1,537.00 Million by 2032 with 6.2% CAGR | Research Dive",20230628T130500,"New York, USA, June 28, 2023 ( GLOBE NEWSWIRE ) -- According to a report published by Research Dive, the global concrete densifier market is anticipated to generate a revenue of $1,537.00 million and grow at a CAGR of 6.2% throughout the estimated period from 2022 to 2032.","[{'ticker': 'SHW', 'relevance_score': '0.056674', 'ticker_sentiment_score': '0.0', 'ticker_sentiment_label': 'Neutral'}]"
Here's How Much You Would Have Made Owning Sherwin-Williams Stock In The Last 15 Years - Sherwin-Williams  ( NYSE:SHW ) ,20230628T213229,"Sherwin-Williams SHW has outperformed the market over the past 15 years by 11.76% on an annualized basis producing an average annual return of 20.38%. Currently, Sherwin-Williams has a market capitalization of $66.03 billion.","[{'ticker': 'SHW', 'relevance_score': '0.983605', 'ticker_sentiment_score': '0.387251', 'ticker_sentiment_label': 'Bullish'}]"
Acrylic Powder Market size to grow by USD 820.67 million from 2022 to 2027|Growing emphasis on aesthetic appeal to be a major growth driver - Technavio,20230630T041500,Acrylic Powder Market size to grow by USD 820.67 million from 2022 to 2027|Growing emphasis on aesthetic appeal to ... PR ...,"[{'ticker': 'SHW', 'relevance_score': '0.025219', 'ticker_sentiment_score': '0.023614', 'ticker_sentiment_label': 'Neutral'}]"
Sherwin-Williams  ( SHW )  Hits 52-Week High: What's Aiding It?,20230703T160900,"Sherwin-Williams' (SHW) cost-cutting measures, working capital reductions, supply-chain optimization and productivity enhancement are producing margin benefits.","[{'ticker': 'SHW', 'relevance_score': '0.411848', 'ticker_sentiment_score': '0.432195', 'ticker_sentiment_label': 'Bullish'}]"
SHW: 3 Home Improvement Stocks Worth Buying This July,20230704T114922,"The home improvement industry is growing due to increased demand for home remodeling and technology advancements. So, quality home improvement stocks The Sherwin-Williams Company ( SHW ) , Kingfisher plc ( KGFHY ) , and Energizer Holdings, Inc. ( ENR ) could be wise additions to your portfolio ...","[{'ticker': 'SHW', 'relevance_score': '0.282234', 'ticker_sentiment_score': '0.321351', 'ticker_sentiment_label': 'Somewhat-Bullish'}]"
Here's How Much You'd Have If You Invested $1000 in Sherwin-Williams a Decade Ago,20230707T123006,Holding on to popular or trending stocks for the long-term can make your portfolio a winner.,"[{'ticker': 'SHW', 'relevance_score': '0.648037', 'ticker_sentiment_score': '0.25425', 'ticker_sentiment_label': 'Somewhat-Bullish'}]"
Why Sherwin-Williams Stock Gained 17% in June,20230710T203257,Shares of the paint company gained on signs of a recovery in the housing market and other demand trends.,"[{'ticker': 'SHW', 'relevance_score': '0.537474', 'ticker_sentiment_score': '0.506325', 'ticker_sentiment_label': 'Bullish'}]"
Why You Should Add Sherwin-Williams  ( SHW )  to Your Portfolio,20230711T125400,"Sherwin Williams' (SHW) cost-cutting initiatives, working capital reductions, supply chain optimization and productivity enhancements are resulting in margin growth.","[{'ticker': 'SHW', 'relevance_score': '0.659096', 'ticker_sentiment_score': '0.56923', 'ticker_sentiment_label': 'Bullish'}]"
Neurocrine Biosciences Announces Appointment of Christine A. Poon to Board of Directors,20230711T200500,"SAN DIEGO, July 11, 2023 /PRNewswire/ -- Neurocrine Biosciences, Inc. ( Nasdaq: NBIX ) today announced that it appointed Christine A. Poon, a business leader with extensive experience in the pharmaceutical industry, to its Board of Directors.","[{'ticker': 'SHW', 'relevance_score': '0.07913', 'ticker_sentiment_score': '0.032424', 'ticker_sentiment_label': 'Neutral'}]"
Looking Into Sherwin-Williams's Recent Short Interest - Sherwin-Williams  ( NYSE:SHW ) ,20230713T131540,"Sherwin-Williams's SHW short percent of float has fallen 4.96% since its last report. The company recently reported that it has 2.74 million shares sold short, which is 1.15% of all regular shares that are available for trading.","[{'ticker': 'SHW', 'relevance_score': '0.224903', 'ticker_sentiment_score': '0.085754', 'ticker_sentiment_label': 'Neutral'}]"
Sherwin-Williams  ( SHW )  Stock Up 15% in 3 Months: Here's Why,20230718T123400,Sherwin Williams (SHW) is benefiting from robust domestic demand and continues to undertake pricing actions to offset cost increases.,"[{'ticker': 'SHW', 'relevance_score': '0.323078', 'ticker_sentiment_score': '0.346552', 'ticker_sentiment_label': 'Somewhat-Bullish'}]"
The Sherwin-Williams Company Elects New Director,20230719T170000,"CLEVELAND, July 19, 2023 /PRNewswire/ -- The Sherwin-Williams Company ( NYSE: SHW ) announced that its Board of Directors elected Thomas L. Williams to the Board, effective yesterday. Mr. Williams also was appointed to the Compensation and Management Development Committee of the Board.","[{'ticker': 'SHW', 'relevance_score': '0.653175', 'ticker_sentiment_score': '0.302234', 'ticker_sentiment_label': 'Somewhat-Bullish'}]"
"Industrial Coatings Market Size to Hit USD 118.4 billion by 2031, Expanding at a CAGR of 5.4%: TMR Report",20230721T173000,"Wilmington, Delaware, United States, July 21, 2023 ( GLOBE NEWSWIRE ) -- Transparency Market Research Inc. - The global industrial coatings market is projected to flourish at a CAGR of 5.4% from 2023 to 2031. As per the report published by TMR, a valuation of US$ 118.4 billion is anticipated for ...","[{'ticker': 'SHW', 'relevance_score': '0.041538', 'ticker_sentiment_score': '0.0', 'ticker_sentiment_label': 'Neutral'}]"
Here's How Much a $1000 Investment in Sherwin-Williams Made 10 Years Ago Would Be Worth Today,20230724T123005,"Why investing for the long run, especially if you buy certain popular stocks, could reap huge rewards.","[{'ticker': 'SHW', 'relevance_score': '0.591019', 'ticker_sentiment_score': '0.395869', 'ticker_sentiment_label': 'Bullish'}]"
What's in the Cards for Sherwin-Williams  ( SHW )  in Q2 Earnings?,20230724T143100,Sherwin-Williams' (SHW) Q2 performance is likely to have been supported by cost reductions and margin improvement initiatives amid headwinds from a challenging demand environment.,"[{'ticker': 'SHW', 'relevance_score': '0.597963', 'ticker_sentiment_score': '0.259994', 'ticker_sentiment_label': 'Somewhat-Bullish'}]"
$1000 Invested In Sherwin-Williams 15 Years Ago Would Be Worth This Much Today - Sherwin-Williams  ( NYSE:SHW ) ,20230724T183024,"Sherwin-Williams SHW has outperformed the market over the past 15 years by 10.78% on an annualized basis producing an average annual return of 19.7%. Currently, Sherwin-Williams has a market capitalization of $68.78 billion.","[{'ticker': 'SHW', 'relevance_score': '0.983605', 'ticker_sentiment_score': '0.387251', 'ticker_sentiment_label': 'Bullish'}]"
"Automotive Refinish Coatings Market all set to rise at growth rate of 4.34% CAGR | Valuation at $2,428.29 million - PR Newswire",20230725T080000,"Automotive Refinish Coatings Market all set to rise at growth rate of 4.34% CAGR | Valuation at $2,428.29 million PR ...","[{'ticker': 'SHW', 'relevance_score': '0.032646', 'ticker_sentiment_score': '0.102043', 'ticker_sentiment_label': 'Neutral'}]"
The Sherwin-Williams Company Reports 2023 Second Quarter Financial Results,20230725T110000,"CLEVELAND, July 25, 2023 /PRNewswire/ -- The Sherwin-Williams Company ( NYSE: SHW ) announced its financial results for the second quarter ended June 30, 2023.","[{'ticker': 'SHW', 'relevance_score': '0.124405', 'ticker_sentiment_score': '0.178814', 'ticker_sentiment_label': 'Somewhat-Bullish'}]"
Sherwin-Williams  ( SHW )  Q2 Earnings and Revenues Top Estimates,20230725T122506,"Sherwin-Williams (SHW) delivered earnings and revenue surprises of 21.40% and 3.73%, respectively, for the quarter ended June 2023. Do the numbers hold clues to what lies ahead for the stock?","[{'ticker': 'SHW', 'relevance_score': '0.399204', 'ticker_sentiment_score': '0.243865', 'ticker_sentiment_label': 'Somewhat-Bullish'}]"
"Sherwin-Williams  ( SHW )  Beats on Q2 Earnings & Sales, Ups View",20230725T140700,The uptick in sales of Sherwin-Williams (SHW) is primarily attributable to higher selling prices and architectural sales volumes in Q2.,"[{'ticker': 'SHW', 'relevance_score': '0.486729', 'ticker_sentiment_score': '0.15408', 'ticker_sentiment_label': 'Somewhat-Bullish'}]"
"Bulls Encouraged By Stimulus From China, Strength In Djia, And Finally Good Earnings - Apple  ( NASDAQ:AAPL ) ",20230725T151107,"To gain an edge, this is what you need to know today. Please click here for a chart of SPDR Dow Jones Industrial Average ETF Trust DIA. The chart shows that the Dow Jones Industrial Average has gone straight up in the month of July.","[{'ticker': 'SHW', 'relevance_score': '0.098255', 'ticker_sentiment_score': '0.363329', 'ticker_sentiment_label': 'Bullish'}]"
2 Stocks Getting Positive Attention From Wall Street on Tuesday,20230725T155000,Find out the early winners in the stock market.,"[{'ticker': 'SHW', 'relevance_score': '0.583927', 'ticker_sentiment_score': '0.680193', 'ticker_sentiment_label': 'Bullish'}]"
"Stocks making the biggest moves midday: Spotify, RTX, General Electric and more",20230725T161651,These are the stocks posting the largest moves in midday trading.,"[{'ticker': 'SHW', 'relevance_score': '0.035086', 'ticker_sentiment_score': '0.133273', 'ticker_sentiment_label': 'Neutral'}]"
US stocks end higher as markets await Fed rate decision,20230726T005736,"The Dow Jones Industrial Average ended 0.1 percent higher at 35,437.93, extending its winning streak for a 12th straight session.","[{'ticker': 'SHW', 'relevance_score': '0.131643', 'ticker_sentiment_score': '0.055447', 'ticker_sentiment_label': 'Neutral'}]"
Cramer shares insights to help make sense of this earnings season,20230726T011629,CNBC's Jim Cramer on Tuesday shared the strategy he follows to try to understand how and why stocks move during earnings season.,"[{'ticker': 'SHW', 'relevance_score': '0.159569', 'ticker_sentiment_score': '0.111724', 'ticker_sentiment_label': 'Neutral'}]"
"Polyurea Coatings Market to Grow at an 8.5% CAGR from 2023 to 2031, Reaching USD 2.3 billion: TMR Report",20230726T111500,"Wilmington, Delaware, United States, July 26, 2023 ( GLOBE NEWSWIRE ) -- Transparency Market Research Inc. - The global polyurea coatings market is anticipated to grow at an 8.5% CAGR from 2023 to 2031. A market valuation of US$ 2.3 billion is expected by end of the forecast period.","[{'ticker': 'SHW', 'relevance_score': '0.039418', 'ticker_sentiment_score': '0.203637', 'ticker_sentiment_label': 'Somewhat-Bullish'}]"
Sherwin-Williams  ( SHW )  Upgraded to Strong Buy: Here's What You Should Know,20230726T160006,"Sherwin-Williams (SHW) has been upgraded to a Zacks Rank #1 (Strong Buy), reflecting growing optimism about the company's earnings prospects. This might drive the stock higher in the near term.","[{'ticker': 'SHW', 'relevance_score': '0.360752', 'ticker_sentiment_score': '0.341315', 'ticker_sentiment_label': 'Somewhat-Bullish'}]"
Opinion | Companies Aren't Eager to Cut Their Prices as Costs Fall,20230726T190002,Opinion | Business Is Betting That Consumers Have Gotten Used to High Prices The New York Times ...,"[{'ticker': 'SHW', 'relevance_score': '0.089295', 'ticker_sentiment_score': '0.099284', 'ticker_sentiment_label': 'Neutral'}]"
3 Top-Rated Stocks to Buy on the Earnings Beat,20230726T210900,"Sherwin-Williams (SHW), Kimberly-Clark (KMB), and PACCAR (PCAR) are three stocks investors should consider buying after their strong second-quarter results on Wednesday.","[{'ticker': 'SHW', 'relevance_score': '0.448842', 'ticker_sentiment_score': '0.447193', 'ticker_sentiment_label': 'Bullish'}]"
"Sherwin-Williams Clears Technical Benchmark, Hitting 80-Plus RS Rating",20230727T070000,"The Relative Strength ( RS ) Rating for Sherwin-Williams ( SHW ) jumped into a new percentile Thursday, with a rise from 79 to 84. X When looking for the best stocks to buy and watch, be sure to pay attention to relative price strength.","[{'ticker': 'SHW', 'relevance_score': '0.644033', 'ticker_sentiment_score': '0.32642', 'ticker_sentiment_label': 'Somewhat-Bullish'}]"
Sherwin-Williams and Cracker Barrel have been highlighted as Zacks Bull and Bear of the Day,20230727T090000,"Chicago, IL - July 27, 2023 - Zacks Equity Research shares Sherwin-Williams ( SHW Quick QuoteSHW - ) as the Bull of the Day and Cracker Barrel Old Country Store ( CBRL Quick QuoteCBRL - ) as the Bear of the Day.","[{'ticker': 'SHW', 'relevance_score': '0.171921', 'ticker_sentiment_score': '0.078801', 'ticker_sentiment_label': 'Neutral'}]"
Bull of the Day: Sherwin Williams  ( SHW ) ,20230727T103000,"This paint company is on a roll, making fresh 2023 highs after a recent earnings report.","[{'ticker': 'SHW', 'relevance_score': '0.431065', 'ticker_sentiment_score': '0.184559', 'ticker_sentiment_label': 'Somewhat-Bullish'}]"
New Strong Buy Stocks for July 28th,20230728T113600,"MDB, YEXT, IAS, MFIN and SHW have been added to the Zacks Rank #1 (Strong Buy) List on July 28, 2023.","[{'ticker': 'SHW', 'relevance_score': '0.379051', 'ticker_sentiment_score': '0.0', 'ticker_sentiment_label': 'Neutral'}]"
"Top 16 Paints and Coatings Companies, Worldwide 2023: MarketsandMarkets 360 Quadrant Revealed - PR Newswire",20230728T143000,"Top 16 Paints and Coatings Companies, Worldwide 2023: MarketsandMarkets 360 Quadrant Revealed PR ...","[{'ticker': 'SHW', 'relevance_score': '0.041755', 'ticker_sentiment_score': '0.141984', 'ticker_sentiment_label': 'Neutral'}]"
"The Zacks Analyst Blog Highlights HSBC, Shopify, Sherwin Williams and Workday",20230801T114100,"HSBC, Shopify, Sherwin Williams and Workday are part of the Zacks top Analyst Blog.","[{'ticker': 'SHW', 'relevance_score': '0.124939', 'ticker_sentiment_score': '0.018327', 'ticker_sentiment_label': 'Neutral'}]"
BDA Advises Sherwin-Williams on Sale of China Architecture Paint Business to AkzoNobel - Sherwin-Williams  ( NYSE:SHW ) ,20230802T115203,"New York, NY August 02, 2023 -- ( PR.com ) -- BDA Partners is pleased to announce that its client, The Sherwin-Williams Company SHW, has completed the divestment of its China architecture paint business, under the brand name Huarun in China, to global coatings company Akzo Nobel NV AKZA.","[{'ticker': 'SHW', 'relevance_score': '0.556946', 'ticker_sentiment_score': '0.330788', 'ticker_sentiment_label': 'Somewhat-Bullish'}]"
Looking Into Sherwin-Williams's Recent Short Interest - Sherwin-Williams  ( NYSE:SHW ) ,20230802T171522,"Sherwin-Williams's SHW short percent of float has risen 10.43% since its last report. The company recently reported that it has 3.02 million shares sold short, which is 1.27% of all regular shares that are available for trading.","[{'ticker': 'SHW', 'relevance_score': '0.224903', 'ticker_sentiment_score': '0.158881', 'ticker_sentiment_label': 'Somewhat-Bullish'}]"
Better Living via Green Technology: Sherwin-Williams Shines at China Coatings Show 2023 - PR Newswire,20230803T044300,Better Living via Green Technology: Sherwin-Williams Shines at China Coatings Show 2023 PR ...,"[{'ticker': 'SHW', 'relevance_score': '0.773865', 'ticker_sentiment_score': '0.576503', 'ticker_sentiment_label': 'Bullish'}]"
1 hurt in explosion at a Sherwin-Williams paint factory plant in Texas,20230807T134704,"At least one factory worker was injured in an explosion and fire at a Sherwin-Williams paint manufacturing and processing plant in the Dallas suburb of Garland, Texas, fire officials said. Firefighters received a call at 1:21 a.m. Monday, according to a Garland Fire Department public information ...","[{'ticker': 'SHW', 'relevance_score': '0.285526', 'ticker_sentiment_score': '-0.357837', 'ticker_sentiment_label': 'Bearish'}]"
Worker injured as explosion at Texas paint plant sends fireballs into sky,20230807T214800,"GARLAND, Texas ( AP ) - A worker was injured early Monday when an explosion set a paint manufacturing plant in the Dallas suburbs ablaze and shot a series of fireballs into the night sky.","[{'ticker': 'SHW', 'relevance_score': '0.358152', 'ticker_sentiment_score': '-0.042933', 'ticker_sentiment_label': 'Neutral'}]"
Georgia Rep. Rick Allen Bought Over $50K Worth of Sherwin-Williams Stock: Here's What You Should Know - Sherwin-Williams  ( NYSE:SHW ) ,20230811T150505,"Rick Allen, a Representative from Georgia, reported a purchase of Sherwin-Williams SHW stock on August 10, 2023. According to the Periodic Transaction Report the transaction was placed on August 10, 2023.","[{'ticker': 'SHW', 'relevance_score': '0.592742', 'ticker_sentiment_score': '0.164911', 'ticker_sentiment_label': 'Somewhat-Bullish'}]"
Momentum Alert: 3 Top Ranked Stocks Primed for a Breakout,20230811T163500,"Rather than a sharp downward correction, many stocks have corrected in time and built out some sideways action ...","[{'ticker': 'SHW', 'relevance_score': '0.342939', 'ticker_sentiment_score': '0.302284', 'ticker_sentiment_label': 'Somewhat-Bullish'}]"
3 Buy-Rated Construction Stocks With Bright Outlooks,20230811T191400,"Construction stocks have enjoyed favorable earnings estimate revisions over the last several months, a highly positive development. And these three have been no exception to the shift in sentiment, boasting strong outlooks.","[{'ticker': 'SHW', 'relevance_score': '0.234119', 'ticker_sentiment_score': '0.181946', 'ticker_sentiment_label': 'Somewhat-Bullish'}]"
"Zacks Investment Ideas feature highlights: Amazon, Sherwin Williams and Caterpillar",20230814T103800,"Amazon, Sherwin Williams and Caterpillar are part of the Zacks Investment Ideas article.","[{'ticker': 'SHW', 'relevance_score': '0.378572', 'ticker_sentiment_score': '0.302073', 'ticker_sentiment_label': 'Somewhat-Bullish'}]"
"Materials Sector Fund Down Over Half Of A Billion - ETF Winners And Losers: Medium-Cap Fund Flows - iShares MSCI Emerging Markets ex China ETF  ( NASDAQ:EMXC ) , SPDR S&P Oil & Gas Explor & Product  ( ARCA:XOP ) ",20230814T201627,"We performed a screening of medium-cap ETFs - defined as having Assets Under Management ( AUM ) between $2 billion and $10 billion - to determine what funds had the largest change in net assets on the week, according to data from etfdb.com. Only non-leveraged funds were considered.","[{'ticker': 'SHW', 'relevance_score': '0.191929', 'ticker_sentiment_score': '0.176819', 'ticker_sentiment_label': 'Somewhat-Bullish'}]"
Here's How Much You Would Have Made Owning Sherwin-Williams Stock In The Last 10 Years - Sherwin-Williams  ( NYSE:SHW ) ,20230817T163116,"Sherwin-Williams SHW has outperformed the market over the past 10 years by 6.57% on an annualized basis producing an average annual return of 16.89%. Currently, Sherwin-Williams has a market capitalization of $69.81 billion.","[{'ticker': 'SHW', 'relevance_score': '0.983605', 'ticker_sentiment_score': '0.387251', 'ticker_sentiment_label': 'Bullish'}]"
Investing Lessons from Rich Retirees,20230818T164200,The million-dollar retirement portfolio is the holy grail for savers. How do you get there?,"[{'ticker': 'SHW', 'relevance_score': '0.399506', 'ticker_sentiment_score': '0.226957', 'ticker_sentiment_label': 'Somewhat-Bullish'}]"
These 3 Stocks Could Soon Be Dividend Kings,20230818T204900,"For those seeking companies with a long track record of boosting payouts, all three of these stocks precisely fit the criteria. Who doesn't love payday?","[{'ticker': 'SHW', 'relevance_score': '0.431765', 'ticker_sentiment_score': '0.424958', 'ticker_sentiment_label': 'Bullish'}]"
Powder Coatings Market to grow by USD 4.19 billion from 2022 to 2027 | Increased durability of powder coatings is a ... - PR Newswire,20230819T043000,Powder Coatings Market to grow by USD 4.19 billion from 2022 to 2027 | Increased durability of powder coatings is a ... PR ...,"[{'ticker': 'SHW', 'relevance_score': '0.04823', 'ticker_sentiment_score': '0.150841', 'ticker_sentiment_label': 'Somewhat-Bullish'}]"
"Zacks Value Trader Highlights: Bank of America, The Sherwin-Williams, NVIDIA, Berkshire Hathaway and VOO",20230821T120200,"Bank of America, The Sherwin-Williams, NVIDIA, Berkshire Hathaway and VOO are part of the Zacks Value Trader blog.","[{'ticker': 'SHW', 'relevance_score': '0.311406', 'ticker_sentiment_score': '0.188691', 'ticker_sentiment_label': 'Somewhat-Bullish'}]"
Peering Into Sherwin-Williams's Recent Short Interest - Sherwin-Williams  ( NYSE:SHW ) ,20230821T151521,"Sherwin-Williams's SHW short percent of float has fallen 9.45% since its last report. The company recently reported that it has 2.73 million shares sold short, which is 1.15% of all regular shares that are available for trading.","[{'ticker': 'SHW', 'relevance_score': '0.224903', 'ticker_sentiment_score': '0.085754', 'ticker_sentiment_label': 'Neutral'}]"
"Automotive Coatings Market worth $18.6 billion by 2027 Globally, at a CAGR of 4.3 %, says MarketsandMarkets™",20230822T113000,"Chicago, Aug. 22, 2023 ( GLOBE NEWSWIRE ) -- The global Automotive Coatings Market size is projected to grow from USD 15.0 billion in 2022 to USD 18.6 billion by 2027, at a CAGR of 4.3%., as per the recent study by MarketsandMarkets™.","[{'ticker': 'SHW', 'relevance_score': '0.047654', 'ticker_sentiment_score': '0.105841', 'ticker_sentiment_label': 'Neutral'}]"
Why You Should Add Sherwin-Williams  ( SHW )  to Your Portfolio,20230822T145100,"Sherwin-Williams' (SHW) cost-cutting initiatives, working capital reductions, supply chain optimization and productivity enhancements are resulting in margin growth.","[{'ticker': 'SHW', 'relevance_score': '0.617346', 'ticker_sentiment_score': '0.539165', 'ticker_sentiment_label': 'Bullish'}]"
3 Top Ranked Compounder Stocks to Buy Now and Never Sell,20230823T204000,These stocks outperform the market on almost every time frames ...,"[{'ticker': 'SHW', 'relevance_score': '0.176825', 'ticker_sentiment_score': '0.139848', 'ticker_sentiment_label': 'Neutral'}]"
Sherwin-Williams  ( SHW )  Down 3.2% Since Last Earnings Report: Can It Rebound?,20230824T153041,Sherwin-Williams (SHW) reported earnings 30 days ago. What's next for the stock? We take a look at earnings estimates for some clues.,"[{'ticker': 'SHW', 'relevance_score': '0.420483', 'ticker_sentiment_score': '0.152283', 'ticker_sentiment_label': 'Somewhat-Bullish'}]"
Cellulosic Fire Protection Intumescent Coatings Market worth $725 million by 2028 - Exclusive Report by MarketsandMarkets™,20230825T080000,Cellulosic Fire Protection Intumescent Coatings Market worth $725 million by 2028 - Exclusive Report by ... PR ...,"[{'ticker': 'SHW', 'relevance_score': '0.037504', 'ticker_sentiment_score': '-0.011708', 'ticker_sentiment_label': 'Neutral'}]"
"Refinish Paint Market to Exceed USD11.2 billion by 2031, Expanding at a CAGR of 4.7% Says Transparency Market Research",20230825T123000,"Wilmington, Delaware, United States, Aug. 25, 2023 ( GLOBE NEWSWIRE ) -- Transparency Market Research Inc. - The global refinish paint market is projected to flourish at a CAGR of 4.7% from 2023 to 2031. As per the report published by TMR, a valuation of US$ 11.2 billion is anticipated for the ...","[{'ticker': 'SHW', 'relevance_score': '0.045054', 'ticker_sentiment_score': '0.0', 'ticker_sentiment_label': 'Neutral'}]"
Weekly Roundup,20230825T220100,"Stocks staged a late comeback this week after Fed Chair Jerome Powell's comments at Jackson Hole that were hawkish -- but which many interpreted as not so much. The collective move in stocks over the last month, however, has been negative, with the S&P 500 shedding roughly 4%, while the Nasdaq ...","[{'ticker': 'SHW', 'relevance_score': '0.003334', 'ticker_sentiment_score': '0.125775', 'ticker_sentiment_label': 'Neutral'}]"
"Carboxymethyl Cellulose Market to Expand USD 1.85 million by 2031, Registering at a CAGR of 3.6% | Exclusive Report by Transparency Market Research",20230828T093000,"Wilmington, Delaware, United States, Aug. 28, 2023 ( GLOBE NEWSWIRE ) -- Transparency Market Research Inc. - The global carboxymethyl cellulose market is projected to flourish at a CAGR of 3.6% from 2021 to 2031. As per the report published by TMR, a valuation of US$ 1.85 million is anticipated ...","[{'ticker': 'SHW', 'relevance_score': '0.042421', 'ticker_sentiment_score': '0.098673', 'ticker_sentiment_label': 'Neutral'}]"
Is Invesco S&P 500 Equal Weight Materials ETF  ( RSPM )  a Strong ETF Right Now?,20230828T102007,Smart Beta ETF report for ...,"[{'ticker': 'SHW', 'relevance_score': '0.118354', 'ticker_sentiment_score': '0.060615', 'ticker_sentiment_label': 'Neutral'}]"
"HGTV ANNOUNCES WINNER OF HGTV SMART HOME 2023 IN SANTA FE, NEW MEXICO - Frontdoor  ( NASDAQ:FTDR ) ",20230828T140000,"Stacey Braswell of Kingsport, Tennessee, is the Recipient of the Grand Prize Package Valued at Over $2.2 Million NEW YORK, Aug. 28, 2023 /PRNewswire/ -- HGTV, a member of the Warner Bros.","[{'ticker': 'SHW', 'relevance_score': '0.049732', 'ticker_sentiment_score': '0.162155', 'ticker_sentiment_label': 'Somewhat-Bullish'}]"
