title,time_published,summary,ticker_sentiment
Looking Into Sherwin-Williams's Recent Short Interest - Sherwin-Williams  ( NYSE:SHW ) ,20240424T191525,"Sherwin-Williams's SHW short percent of float has fallen 9.82% since its last report. The company recently reported that it has 2.56 million shares sold short, which is 1.01% of all regular shares that are available for trading.","[{'ticker': 'SHW', 'relevance_score': '0.212115', 'ticker_sentiment_score': '0.081887', 'ticker_sentiment_label': 'Neutral'}]"
Toronto's Living Luxe Design Show Sets a New Standard for Luxury Exhibitions After Triumphant Weekend,20240424T202600,Thousands of Torontonians flocked to the Toronto Congress Centre for a three-day grand-scale exhibition at the Living Luxe Design Show Download Images here - Credit: Living Luxe Media Group,"[{'ticker': 'SHW', 'relevance_score': '0.033282', 'ticker_sentiment_score': '0.048093', 'ticker_sentiment_label': 'Neutral'}]"
Why Berkshire Hathaway Should Be in the Magnificent 7,20240426T000500,Warren Buffett's Berkshire Hathaway is now in the Top 7 stocks in the S&P 500. Let's give it its due.,"[{'ticker': 'SHW', 'relevance_score': '0.406745', 'ticker_sentiment_score': '-0.049269', 'ticker_sentiment_label': 'Neutral'}]"
Sherwin-Williams  ( NYSE:SHW )  Rating Lowered to Hold at StockNews.com,20240427T084844,"Sherwin-Williams ( NYSE:SHW - Get Free Report ) was downgraded by stock analysts at StockNews.com from a ""buy"" rating to a ""hold"" rating in a research note issued to investors on Thursday. Several other research analysts have also commented on the company.","[{'ticker': 'SHW', 'relevance_score': '0.834113', 'ticker_sentiment_score': '0.357304', 'ticker_sentiment_label': 'Bullish'}]"
"Zacks Value Investor Highlights: Berkshire Hathaway, Alphabet, Sherwin-Williams, Masco and Armstrong World",20240429T095600,"Berkshire Hathaway, Alphabet, Sherwin-Williams, Masco and Armstrong World have been highlighted in this Value Investor article.","[{'ticker': 'SHW', 'relevance_score': '0.29234', 'ticker_sentiment_score': '-0.038277', 'ticker_sentiment_label': 'Neutral'}]"
Here's How Much You Would Have Made Owning Sherwin-Williams Stock In The Last 15 Years - Sherwin-Williams  ( NYSE:SHW ) ,20240430T203030,"Sherwin-Williams SHW has outperformed the market over the past 15 years by 8.13% on an annualized basis producing an average annual return of 20.09%. Currently, Sherwin-Williams has a market capitalization of $76.13 billion.","[{'ticker': 'SHW', 'relevance_score': '0.95919', 'ticker_sentiment_score': '0.384695', 'ticker_sentiment_label': 'Bullish'}]"
Why Sherwin-Williams  ( SHW )  is a Top Growth Stock for the Long-Term,20240503T134506,The Zacks Style Scores offers investors a way to easily find top-rated stocks based on their investing style. Here's why you should take advantage.,"[{'ticker': 'SHW', 'relevance_score': '0.644033', 'ticker_sentiment_score': '0.411426', 'ticker_sentiment_label': 'Bullish'}]"
Stocks Flashing Renewed Technical Strength: Axalta Coating Systems,20240508T070000,"On Wednesday, Axalta Coating Systems ( AXTA ) got an upgrade to its Relative Strength ( RS ) Rating, from 78 to 81. X This unique rating identifies technical performance by showing how a stock's price movement over the last 52 weeks compares to that of the other stocks in our database.","[{'ticker': 'SHW', 'relevance_score': '0.350564', 'ticker_sentiment_score': '0.0', 'ticker_sentiment_label': 'Neutral'}]"
Should You Invest in the Fidelity MSCI Materials Index ETF  ( FMAT ) ?,20240513T102005,Sector ETF report for ...,"[{'ticker': 'SHW', 'relevance_score': '0.132733', 'ticker_sentiment_score': '0.053185', 'ticker_sentiment_label': 'Neutral'}]"
How Is The Market Feeling About Sherwin-Williams? - Sherwin-Williams  ( NYSE:SHW ) ,20240513T134519,"Sherwin-Williams's SHW short percent of float has risen 11.88% since its last report. The company recently reported that it has 2.86 million shares sold short, which is 1.13% of all regular shares that are available for trading.","[{'ticker': 'SHW', 'relevance_score': '0.212115', 'ticker_sentiment_score': '0.151778', 'ticker_sentiment_label': 'Somewhat-Bullish'}]"
"$1000 Invested In This Stock 5 Years Ago Would Be Worth $2,200 Today - Sherwin-Williams  ( NYSE:SHW ) ",20240516T140025,"Sherwin-Williams SHW has outperformed the market over the past 5 years by 3.92% on an annualized basis producing an average annual return of 17.02%. Currently, Sherwin-Williams has a market capitalization of $80.09 billion.","[{'ticker': 'SHW', 'relevance_score': '0.95919', 'ticker_sentiment_score': '0.384695', 'ticker_sentiment_label': 'Bullish'}]"
Should You Invest in the Vanguard Materials ETF  ( VAW ) ?,20240521T102008,Sector ETF report for VAW ...,"[{'ticker': 'SHW', 'relevance_score': '0.13459', 'ticker_sentiment_score': '0.070304', 'ticker_sentiment_label': 'Neutral'}]"
"HGTV ANNOUNCES WINNER OF HGTV DREAM HOME 2024 IN ANASTASIA ISLAND, FLORIDA",20240522T140000,"Marie Fratta of Westchester County, New York, is the Recipient of the Grand Prize Package Valued at Over $2.2 Million NEW YORK, May 22, 2024 /PRNewswire/ -- HGTV, a member of the Warner Bros. Discovery family of brands, today announced the winner of the HGTV Dream Home is Marie Fratta of ...","[{'ticker': 'SHW', 'relevance_score': '0.069697', 'ticker_sentiment_score': '0.10444', 'ticker_sentiment_label': 'Neutral'}]"
Sherwin-Williams  ( SHW )  Up 1.2% Since Last Earnings Report: Can It Continue?,20240523T153039,Sherwin-Williams (SHW) reported earnings 30 days ago. What's next for the stock? We take a look at earnings estimates for some clues.,"[{'ticker': 'SHW', 'relevance_score': '0.446546', 'ticker_sentiment_score': '0.166252', 'ticker_sentiment_label': 'Somewhat-Bullish'}]"
"How Ace Hardware, America's neighborhood hardware store for 100 years, is beating its big-box rivals | Business",20240524T185000,"How Ace Hardware, America's neighborhood hardware store for 100 years, is beating its big-box rivals ...","[{'ticker': 'SHW', 'relevance_score': '0.025272', 'ticker_sentiment_score': '0.042906', 'ticker_sentiment_label': 'Neutral'}]"
Are Dividends on the Way Back?,20240527T121556,Savers and investors have few causes for complaint. But one frustration is the sluggish pace and shrunken heft of dividend increases.,"[{'ticker': 'SHW', 'relevance_score': '0.060848', 'ticker_sentiment_score': '-0.007018', 'ticker_sentiment_label': 'Neutral'}]"
"Instant Pot Brands Welcomes Jerry Cook as Chief Commercial Officer and Zsuzsa Leber as Executive Vice President, Marketing, eCommerce & Consumer Care",20240528T170000,Instant Pot Brands Welcomes Jerry Cook as Chief Commercial Officer and Zsuzsa Leber as Executive Vice President ... PR ...,"[{'ticker': 'SHW', 'relevance_score': '0.04823', 'ticker_sentiment_score': '0.18184', 'ticker_sentiment_label': 'Somewhat-Bullish'}]"
Should You Invest in the Materials Select Sector SPDR ETF  ( XLB ) ?,20240529T102006,Sector ETF report for ...,"[{'ticker': 'SHW', 'relevance_score': '0.130571', 'ticker_sentiment_score': '0.069241', 'ticker_sentiment_label': 'Neutral'}]"
Varney: Biden can't win re-election if he can't get Black voters back,20240530T154200,"During his ""My Take"" on Thursday, ""Varney & Co."" host Stuart Varney argued President Biden is getting ""desperate"" to turn things around with Black voters after a Fox poll showed he dropped a disastrous 19 points with the important voting group.","[{'ticker': 'SHW', 'relevance_score': '0.098659', 'ticker_sentiment_score': '0.257833', 'ticker_sentiment_label': 'Somewhat-Bullish'}]"
"Should You Invest in the Materials Select Sector SPDR ETF? - Freeport-McMoRan  ( NYSE:FCX ) , SPDR S&P Global Natural Resources ETF  ( ARCA:GNR ) ",20240530T171130,"Looking for broad exposure to the Materials - Broad segment of the equity market? You should consider the Materials Select Sector SPDR ETF XLB, a passively managed exchange traded fund launched on 12/16/1998.","[{'ticker': 'SHW', 'relevance_score': '0.13459', 'ticker_sentiment_score': '0.113481', 'ticker_sentiment_label': 'Neutral'}]"
Ball Corporation Board Appoints Aaron Erter as Director,20240603T204600,"WESTMINSTER, Colo., June 3, 2024 /PRNewswire/ -- Ball Corporation's ( NYSE: BALL ) board of directors has appointed Aaron Erter, CEO of James Hardie Industries plc, the world's leading producer and marketer of high-performance fiber cement siding and fiber gypsum building solutions, to serve as ...","[{'ticker': 'SHW', 'relevance_score': '0.085022', 'ticker_sentiment_score': '0.09164', 'ticker_sentiment_label': 'Neutral'}]"
2 Housing Stocks That Look Like Buys,20240604T162800,"Housing stocks have dropped, presenting a buying opportunity for shares of the best operators in the industry. The SPDR S&P Homebuilders exchange-traded fund owns home builders such as Lennar Homes , building-materials makers such as Vulcan Materials , home-improvement retailers, and others.","[{'ticker': 'SHW', 'relevance_score': '0.057215', 'ticker_sentiment_score': '0.142057', 'ticker_sentiment_label': 'Neutral'}]"
Sherwin-Williams Reveals Partnership with Leagues Cup,20240605T133000,"Sherwin-Williams and Leagues Cup join forces in a vibrant partnership, blending the passion for sports with the artistry of color. CLEVELAND, June 5, 2024 /PRNewswire/ -- Sherwin-Williams, the global leader in paints and coatings, is proud to be the 2024 Leagues Cup Official Paint Partner.","[{'ticker': 'SHW', 'relevance_score': '0.60244', 'ticker_sentiment_score': '0.600091', 'ticker_sentiment_label': 'Bullish'}]"
Air Products & Chemicals A Top Socially Responsible Dividend Stock,20240605T140920,"Air Products & Chemicals has been named a Top Socially Responsible Dividend Stock by Dividend Channel, signifying a stock with above-average ''DividendRank'' statistics including a strong 2.6% yield, as well as being recognized by prominent asset managers as being a socially responsible ...","[{'ticker': 'SHW', 'relevance_score': '0.157483', 'ticker_sentiment_score': '0.0', 'ticker_sentiment_label': 'Neutral'}]"
Looking Into Sherwin-Williams's Recent Short Interest - Sherwin-Williams  ( NYSE:SHW ) ,20240606T151515,"Sherwin-Williams's SHW short percent of float has fallen 14.0% since its last report. The company recently reported that it has 3.26 million shares sold short, which is 1.29% of all regular shares that are available for trading.","[{'ticker': 'SHW', 'relevance_score': '0.212115', 'ticker_sentiment_score': '0.081887', 'ticker_sentiment_label': 'Neutral'}]"
"HGTV® SMART HOME 2024 IN ATLANTA, GEORGIA SWEEPSTAKES TO CLOSE ON JUNE 10, 2024",20240607T140000,"The Winner Will Receive a Prize Package Valued at Over $1 Million NEW YORK, June 7, 2024 /PRNewswire/ -- The HGTV® Smart Home 2024 located in Atlanta, Georgia will close its sweepstakes on Monday, June 10, 2024, at 5 p.m.","[{'ticker': 'SHW', 'relevance_score': '0.055109', 'ticker_sentiment_score': '0.13085', 'ticker_sentiment_label': 'Neutral'}]"
"HGTV® SMART HOME 2024 IN ATLANTA, GEORGIA SWEEPSTAKES TO CLOSE ON JUNE 10, 2024",20240607T140000,"The Winner Will Receive a Prize Package Valued at Over $1 Million NEW YORK, June 7, 2024 /PRNewswire/ -- The HGTV® Smart Home 2024 located in Atlanta, Georgia will close its sweepstakes on Monday, June 10, 2024, at 5 p.m.","[{'ticker': 'SHW', 'relevance_score': '0.05833', 'ticker_sentiment_score': '0.130994', 'ticker_sentiment_label': 'Neutral'}]"
3 Dividend Stocks That Are Coiled Springs for a Rebound in the Housing Market,20240610T090300,Many companies directly or indirectly benefit from strong consumer spending on housing and home improvement.,"[{'ticker': 'SHW', 'relevance_score': '0.039096', 'ticker_sentiment_score': '0.173103', 'ticker_sentiment_label': 'Somewhat-Bullish'}]"
Top 5 Materials Stocks That Could Blast Off In June - Steel Dynamics  ( NASDAQ:STLD ) ,20240610T115554,"The most oversold stocks in the materials sector presents an opportunity to buy into undervalued companies. The RSI is a momentum indicator, which compares a stock's strength on days when prices go up to its strength on days when prices go down.","[{'ticker': 'SHW', 'relevance_score': '0.233556', 'ticker_sentiment_score': '0.082734', 'ticker_sentiment_label': 'Neutral'}]"
US Rep. Nancy Mace faces primary challenge in South Carolina after tumultuous term,20240611T041000,"COLUMBIA, S.C. ( AP ) - Republican U.S. Rep. Nancy Mace of South Carolina is seeking a third term with the who tried to stop her from getting a second - former President Donald Trump.","[{'ticker': 'SHW', 'relevance_score': '0.045139', 'ticker_sentiment_score': '0.142073', 'ticker_sentiment_label': 'Neutral'}]"
"If You Invested $1000 In This Stock 10 Years Ago, You Would Have $4,400 Today - Sherwin-Williams  ( NYSE:SHW ) ",20240611T200123,"Sherwin-Williams SHW has outperformed the market over the past 10 years by 5.23% on an annualized basis producing an average annual return of 15.88%. Currently, Sherwin-Williams has a market capitalization of $74.83 billion.","[{'ticker': 'SHW', 'relevance_score': '0.95919', 'ticker_sentiment_score': '0.384695', 'ticker_sentiment_label': 'Bullish'}]"
South Carolina runoff pits Trump candidate against GOP governor's endorsement,20240625T040600,"COLUMBIA, S.C. ( AP ) - former President Donald Trump and South Carolina Gov. Henry McMaster are on opposite sides as voters on Tuesday in the state's 3rd Congressional District choose their Republican nominee.","[{'ticker': 'SHW', 'relevance_score': '0.045139', 'ticker_sentiment_score': '0.229018', 'ticker_sentiment_label': 'Somewhat-Bullish'}]"
McKinney Launches 15th Annual Food and Beverage Trends Report,20240626T144000,"Declares 2024 Consumer Macro Trend: ""Vibe Whiplash""","[{'ticker': 'SHW', 'relevance_score': '0.051999', 'ticker_sentiment_score': '0.16583', 'ticker_sentiment_label': 'Somewhat-Bullish'}]"
Should You Invest in the Fidelity MSCI Materials Index ETF  ( FMAT ) ?,20240716T102006,Sector ETF report for ...,"[{'ticker': 'SHW', 'relevance_score': '0.132004', 'ticker_sentiment_score': '0.053038', 'ticker_sentiment_label': 'Neutral'}]"
Sherwin-Williams  ( SHW )  Earnings Expected to Grow: What to Know Ahead of Next Week's Release,20240716T140046,Sherwin-Williams (SHW) doesn't possess the right combination of the two key ingredients for a likely earnings beat in its upcoming report. Get prepared with the key expectations.,"[{'ticker': 'SHW', 'relevance_score': '0.301933', 'ticker_sentiment_score': '0.064592', 'ticker_sentiment_label': 'Neutral'}]"
RPM International  ( RPM )  Earnings Expected to Grow: What to Know Ahead of Next Week's Release,20240718T140115,RPM International (RPM) doesn't possess the right combination of the two key ingredients for a likely earnings beat in its upcoming report. Get prepared with the key expectations.,"[{'ticker': 'SHW', 'relevance_score': '0.173645', 'ticker_sentiment_score': '-0.002836', 'ticker_sentiment_label': 'Neutral'}]"
Top 3 Materials Stocks That May Implode This Month - Sherwin-Williams  ( NYSE:SHW ) ,20240719T115112,"As of July 19, 2024, three stocks in the materials sector could be flashing a real warning to investors who value momentum as a key criteria in their trading decisions. The RSI is a momentum indicator, which compares a stock's strength on days when prices go up to its strength on days when prices ...","[{'ticker': 'SHW', 'relevance_score': '0.355588', 'ticker_sentiment_score': '0.200945', 'ticker_sentiment_label': 'Somewhat-Bullish'}]"
I Have High Hopes for This Top Dividend Stock to Become a Dividend King Before 2030,20240721T113000,Sherwin-Williams has a healthy dividend and is a well-rounded company worth considering now.,"[{'ticker': 'SHW', 'relevance_score': '0.817115', 'ticker_sentiment_score': '0.421807', 'ticker_sentiment_label': 'Bullish'}]"
What's in Store for Sherwin-Williams  ( SHW )  in Q2 Earnings?,20240722T111000,Sherwin-Williams (SHW) is likely to have benefited from cost-cutting initiatives and actions to expand its retail business in Q2 amid headwinds in certain businesses.,"[{'ticker': 'SHW', 'relevance_score': '0.652756', 'ticker_sentiment_score': '0.378642', 'ticker_sentiment_label': 'Bullish'}]"
Should You Invest in the Vanguard Materials ETF  ( VAW ) ?,20240723T102007,Sector ETF report for VAW ...,"[{'ticker': 'SHW', 'relevance_score': '0.136113', 'ticker_sentiment_score': '0.070716', 'ticker_sentiment_label': 'Neutral'}]"
Sherwin-Williams  ( SHW )  Beats Q2 Earnings Estimates,20240723T121508,"Sherwin-Williams (SHW) delivered earnings and revenue surprises of 5.41% and 1.24%, respectively, for the quarter ended June 2024. Do the numbers hold clues to what lies ahead for the stock?","[{'ticker': 'SHW', 'relevance_score': '0.399204', 'ticker_sentiment_score': '0.111297', 'ticker_sentiment_label': 'Neutral'}]"
"Sherwin-Williams'  ( SHW )  Q2 Earnings Top Estimates, Sales Lag",20240723T130200,Consolidated net sales of Sherwin-Williams (SHW) increase primarily owing to higher sales volumes in the Paint Stores and Performance Coatings Groups in Q2.,"[{'ticker': 'SHW', 'relevance_score': '0.454174', 'ticker_sentiment_score': '0.166171', 'ticker_sentiment_label': 'Somewhat-Bullish'}]"
Sherwin-Williams Paints A Rosy Picture: Q2 Profit Soars Amid Sales Challenges - Sherwin-Williams  ( NYSE:SHW ) ,20240723T140030,"Sherwin-Williams Company SHW shares are trading higher after the company reported second-quarter FY24 results. Adjusted earnings per share of $3.70, beating the Wall Street view of $3.48. Quarterly revenue rose 0.5% Y/Y to $6.27 billion, missing the analyst consensus of $6.33 billion.","[{'ticker': 'SHW', 'relevance_score': '0.448316', 'ticker_sentiment_score': '0.388068', 'ticker_sentiment_label': 'Bullish'}]"
Why Sherwin-Williams Stock Is Up Today,20240723T153238,The company delivered strong earnings despite challenging market conditions.,"[{'ticker': 'SHW', 'relevance_score': '0.699089', 'ticker_sentiment_score': '0.602234', 'ticker_sentiment_label': 'Bullish'}]"
Sherwin-Williams Raises Full-Year Guidance in Its 2024 Q2 Report,20240724T194004,Sherwin-Williams posts mixed Q2 2024 results with solid margin improvements and modest revenue growth.,"[{'ticker': 'SHW', 'relevance_score': '0.456107', 'ticker_sentiment_score': '0.564012', 'ticker_sentiment_label': 'Bullish'}]"
How Is The Market Feeling About Sherwin-Williams? - Sherwin-Williams  ( NYSE:SHW ) ,20240725T183018,"Sherwin-Williams's SHW short percent of float has fallen 4.27% since its last report. The company recently reported that it has 3.65 million shares sold short, which is 1.57% of all regular shares that are available for trading.","[{'ticker': 'SHW', 'relevance_score': '0.212115', 'ticker_sentiment_score': '0.081887', 'ticker_sentiment_label': 'Neutral'}]"
Paints and Coatings Market to Help Expand at USD 259.7 Billion by 2031 | SkyQuest Technology,20240726T120000,"Westford, USA, July 26, 2024 ( GLOBE NEWSWIRE ) -- SkyQuest projects that the Paints and Coatings Market will attain a value of USD 259.7 Billion by 2031, with a CAGR of 5.5 % during the forecast period ( 2024-2031 ) .","[{'ticker': 'SHW', 'relevance_score': '0.036255', 'ticker_sentiment_score': '0.478862', 'ticker_sentiment_label': 'Bullish'}]"
Here's Why Sherwin-Williams  ( SHW )  is a Strong Growth Stock,20240729T134512,The Zacks Style Scores offers investors a way to easily find top-rated stocks based on their investing style. Here's why you should take advantage.,"[{'ticker': 'SHW', 'relevance_score': '0.416844', 'ticker_sentiment_score': '0.327508', 'ticker_sentiment_label': 'Somewhat-Bullish'}]"
Should You Invest in the Materials Select Sector SPDR ETF  ( XLB ) ?,20240730T102006,Sector ETF report for ...,"[{'ticker': 'SHW', 'relevance_score': '0.129516', 'ticker_sentiment_score': '0.068968', 'ticker_sentiment_label': 'Neutral'}]"
"Sherwin-Williams Introduces its 2025 Colormix® Forecast: Capsules alongside the debut of the brand's first podcast, Colormixology™",20240731T133000,"The renowned color trend report embodies unique storylines organized in four capsules expertly chosen by Director of Color Marketing and Podcast Host, Sue Wadden and the Sherwin-Williams Global Trendsight team","[{'ticker': 'SHW', 'relevance_score': '0.585233', 'ticker_sentiment_score': '0.452838', 'ticker_sentiment_label': 'Bullish'}]"
EagleView Hires Mark MacDonald as VP of Enterprise Business Development,20240801T172359,"Rochester, NY, Aug. 01, 2024 ( GLOBE NEWSWIRE ) -- Today EagleView, a leading provider of aerial imagery, announces the hiring of Mark MacDonald as VP of Enterprise Business Development.","[{'ticker': 'SHW', 'relevance_score': '0.239305', 'ticker_sentiment_score': '0.218151', 'ticker_sentiment_label': 'Somewhat-Bullish'}]"
Here's Why Sherwin-Williams  ( SHW )  is a Strong Momentum Stock,20240813T135013,"Wondering how to pick strong, market-beating stocks for your investment portfolio? Look no further than the Zacks Style Scores.","[{'ticker': 'SHW', 'relevance_score': '0.45283', 'ticker_sentiment_score': '0.224204', 'ticker_sentiment_label': 'Somewhat-Bullish'}]"
Why This 1 Growth Stock Could Be a Great Addition to Your Portfolio,20240814T134511,"Whether you're a value, growth, or momentum investor, finding strong stocks becomes easier with the Zacks Style Scores, a top feature of the Zacks Premium research service.","[{'ticker': 'SHW', 'relevance_score': '0.437261', 'ticker_sentiment_score': '0.334958', 'ticker_sentiment_label': 'Somewhat-Bullish'}]"
Sherwin-Williams  ( SHW )  Scales 52-week High: What's Driving It?,20240816T143200,"Sherwin-Williams' (SHW) strong Q2 earnings performance, upbeat earnings guidance and the strength in the Paint Stores Group unit instill optimism about the stock.","[{'ticker': 'SHW', 'relevance_score': '0.586747', 'ticker_sentiment_score': '0.295172', 'ticker_sentiment_label': 'Somewhat-Bullish'}]"
Lowe's Companies  ( LOW )  Q2 2024 Earnings Call Transcript,20240820T164513,"LOW earnings call for the period ending June 30, 2024.","[{'ticker': 'SHW', 'relevance_score': '0.004507', 'ticker_sentiment_score': '0.140984', 'ticker_sentiment_label': 'Neutral'}]"
Sherwin-Williams  ( SHW )  Rallies 16% in 3 Months: Here's Why,20240821T142400,"Sherwin-Williams' (SHW) strong Q2 earnings performance, upbeat earnings guidance and the strength in the Paint Stores Group unit instill optimism about the stock.","[{'ticker': 'SHW', 'relevance_score': '0.588165', 'ticker_sentiment_score': '0.320701', 'ticker_sentiment_label': 'Somewhat-Bullish'}]"
3 Stocks That Raised Their Dividend in Each of the Last 3 Recessions,20240822T084800,Some of the worst economic crises in decades couldn't stop these three companies from lining shareholder pockets with cash.,"[{'ticker': 'SHW', 'relevance_score': '0.327366', 'ticker_sentiment_score': '0.322679', 'ticker_sentiment_label': 'Somewhat-Bullish'}]"
Sherwin-Williams  ( SHW )  Up 7.8% Since Last Earnings Report: Can It Continue?,20240822T153044,Sherwin-Williams (SHW) reported earnings 30 days ago. What's next for the stock? We take a look at earnings estimates for some clues.,"[{'ticker': 'SHW', 'relevance_score': '0.43789', 'ticker_sentiment_score': '0.216458', 'ticker_sentiment_label': 'Somewhat-Bullish'}]"
"Sherwin-Williams, Visa And NNN REIT On CNBC's Final Trades - NNN REIT  ( NYSE:NNN ) ",20240826T124301,"Joshua Brown of Ritholtz Wealth Management named The Sherwin-Williams Company SHW as his final trade during the latest CNBC ""Halftime Report."" Sherwin-Williams hit a fresh all-time high on Friday. The chart looks like a new breakout is in progress, he noted.","[{'ticker': 'SHW', 'relevance_score': '0.524949', 'ticker_sentiment_score': '0.240802', 'ticker_sentiment_label': 'Somewhat-Bullish'}]"
Powder Coatings Market to Exceed Market Valuation of USD 11.88 billion by 2031 | SkyQuest Technology,20240830T133000,"Westford, USA, Aug. 30, 2024 ( GLOBE NEWSWIRE ) -- SkyQuest projects that the global powder coatings market will reach a value of USD 11.88 billion by 2031, with a CAGR of 5.40% during the forecast period ( 2024-2031 ) .","[{'ticker': 'SHW', 'relevance_score': '0.045396', 'ticker_sentiment_score': '0.0', 'ticker_sentiment_label': 'Neutral'}]"
Are You a Growth Investor? This 1 Stock Could Be the Perfect Pick,20240830T134511,"Wondering how to pick strong, market-beating stocks for your investment portfolio? Look no further than the Zacks Style Scores.","[{'ticker': 'SHW', 'relevance_score': '0.532043', 'ticker_sentiment_score': '0.375157', 'ticker_sentiment_label': 'Bullish'}]"
Road Marking Materials Market Size Set to Climb to USD 10.9 Billion by 2034 with a 4.8%: Analysis by Transparency Market Research Inc,20240903T154452,"Wilmington, Delaware, United States, Transparency Market Research Inc. , Sept. 03, 2024 ( GLOBE NEWSWIRE ) -- The global road marking materials market ( Straßenmarkierungsmaterialien ) is estimated to surge at a CAGR of 4.8% from 2024 to 2034.","[{'ticker': 'SHW', 'relevance_score': '0.063763', 'ticker_sentiment_score': '0.007044', 'ticker_sentiment_label': 'Neutral'}]"
SHW's Shares Scale Fresh 52-Week High: What's Driving it?,20240904T112900,"Sherwin-Williams' strong earnings performance, upbeat guidance and the strength in the Paint Stores Group unit instill optimism about the stock.","[{'ticker': 'SHW', 'relevance_score': '0.673107', 'ticker_sentiment_score': '0.333006', 'ticker_sentiment_label': 'Somewhat-Bullish'}]"
Looking Into Sherwin-Williams's Recent Short Interest - Sherwin-Williams  ( NYSE:SHW ) ,20240905T143013,"Sherwin-Williams's SHW short percent of float has risen 14.01% since its last report. The company recently reported that it has 4.16 million shares sold short, which is 1.79% of all regular shares that are available for trading.","[{'ticker': 'SHW', 'relevance_score': '0.212115', 'ticker_sentiment_score': '0.151778', 'ticker_sentiment_label': 'Somewhat-Bullish'}]"
