title,time_published,summary,ticker_sentiment
Sherwin-Williams  ( SHW )  Surpasses Q3 Earnings and Revenue Estimates,20221025T122506,"Sherwin-Williams (SHW) delivered earnings and revenue surprises of 8.85% and 4.13%, respectively, for the quarter ended September 2022. Do the numbers hold clues to what lies ahead for the stock?","[{'ticker': 'SHW', 'relevance_score': '0.391923', 'ticker_sentiment_score': '0.107149', 'ticker_sentiment_label': 'Neutral'}]"
Sherwin-Williams  ( SHW )  Q3 Earnings & Revenues Top Estimates,20221025T130800,Sherwin-Williams' (SHW) Q3 top line were driven by higher selling prices in all segments and higher architectural sales volumes in the Americas Group.,"[{'ticker': 'SHW', 'relevance_score': '0.414559', 'ticker_sentiment_score': '0.254041', 'ticker_sentiment_label': 'Somewhat-Bullish'}]"
US Stocks Extend Rally After Solid Earnings,20221025T140334,"Wall Street stocks rose early Tuesday, extending a rally, following a series of mostly solid earnings from General Motors, Coca-Cola and others. GM reported better-than-expected profits and confirmed its full-year forecast, saying it had seen no sign of weakening consumer demand despite inflation.","[{'ticker': 'SHW', 'relevance_score': '0.24289', 'ticker_sentiment_score': '0.172343', 'ticker_sentiment_label': 'Somewhat-Bullish'}]"
Sherwin-Williams Notches Record Sales After Raising Paint Prices,20221025T154100,"Sherwin-Williams topped sales and profit estimates for the third quarter, notching record revenue for the period, after hiking prices for paint and other products. The manufacturer of coatings implemented a 10% price increase across the Americas on Sept. 6 after noting higher input costs and ...","[{'ticker': 'SHW', 'relevance_score': '0.504646', 'ticker_sentiment_score': '0.338779', 'ticker_sentiment_label': 'Somewhat-Bullish'}]"
"Weber, SAP rise; JetBlue, General Electric fall",20221025T201551,"Weber, SAP rise. JetBlue, General Electric fall The Associated Press - en ...","[{'ticker': 'SHW', 'relevance_score': '0.272788', 'ticker_sentiment_score': '0.0', 'ticker_sentiment_label': 'Neutral'}]"
"General Electric To Surge Around 27%? Plus This Analyst Predicts $44 For General Motors - Adaptive Biotechnologies  ( NASDAQ:ADPT ) , General Electric  ( NYSE:GE ) ",20221026T123801,RBC Capital raised the price target on General Electric Company GE from $81 to $93. General Electric shares fell 0.5% to close at $73.00 on Tuesday. RBC Capital cut General Motors Company GM price target from $45 to $44. GM shares rose 0.5% to $37.19 in pre-market trading.,"[{'ticker': 'SHW', 'relevance_score': '0.666827', 'ticker_sentiment_score': '0.334895', 'ticker_sentiment_label': 'Somewhat-Bullish'}]"
Should You Invest in the Fidelity MSCI Materials Index ETF  ( FMAT ) ?,20221027T102007,Sector ETF report for ...,"[{'ticker': 'SHW', 'relevance_score': '0.130571', 'ticker_sentiment_score': '0.0504', 'ticker_sentiment_label': 'Neutral'}]"
Sherwin-Williams  ( NYSE:SHW )  Upgraded to Buy at StockNews.com,20221028T081242,"Sherwin-Williams ( NYSE:SHW - Get Rating ) was upgraded by StockNews.com from a ""hold"" rating to a ""buy"" rating in a research note issued to investors on Wednesday.","[{'ticker': 'SHW', 'relevance_score': '0.892292', 'ticker_sentiment_score': '0.339046', 'ticker_sentiment_label': 'Somewhat-Bullish'}]"
3 Dividend Stocks to Buy on Sale,20221031T131500,Falling share prices have boosted the yields of these three dividend stocks.,"[{'ticker': 'SHW', 'relevance_score': '0.278486', 'ticker_sentiment_score': '0.068263', 'ticker_sentiment_label': 'Neutral'}]"
Intertribal Artists Descend on Asheville for Indigenous Walls Project Event,20221102T141000,"The Intertribal Graffiti Jam: A first-of-its-kind event in the United States ASHEVILLE, N.C., Nov. 2, 2022 /PRNewswire/ -- At the intersection of Urban Native identity and street art you'll find the Indigenous Walls Project.","[{'ticker': 'SHW', 'relevance_score': '0.051999', 'ticker_sentiment_score': '0.175557', 'ticker_sentiment_label': 'Somewhat-Bullish'}]"
SHERWIN-WILLIAMS AND HOLLYWOOD SIGN TRUST COMPLETE MAKEOVER OF TINSELTOWN'S MARQUEE CELEBRITY,20221102T160300,"Iconic landmark enters its next century gleaming with a fresh coat of Emerald® Rain Refresh paint LOS ANGELES, Nov. 2, 2022 /PRNewswire/ -- The timeless beauty of Tinseltown's biggest star - the Hollywood Sign - has been restored as it enters its next century thanks to a speedy centennial ...","[{'ticker': 'SHW', 'relevance_score': '0.640683', 'ticker_sentiment_score': '0.709868', 'ticker_sentiment_label': 'Bullish'}]"
3 Unstoppable Investments Everyone Needs in Their Portfolio,20221103T114000,Not every company can thrive in -- or even survive -- a wobbly economy.,"[{'ticker': 'SHW', 'relevance_score': '0.193619', 'ticker_sentiment_score': '0.047236', 'ticker_sentiment_label': 'Neutral'}]"
Automotive Coatings Market Worth USD 41.87 Billion by 2029 | Exhibiting a CAGR of 9.8% by 2022-2029,20221104T093834,"Pune, India, Nov. 04, 2022 ( GLOBE NEWSWIRE ) -- The global automotive coatings market size was valued at USD 20.02 billion in 2021 and is projected to reach a valuation of USD 21.75 billion in 2022. The market is expected to reach USD 41.87 billion by 2029 with a CAGR of 9.8% during the forecast ...","[{'ticker': 'SHW', 'relevance_score': '0.04872', 'ticker_sentiment_score': '-0.03751', 'ticker_sentiment_label': 'Neutral'}]"
"If You Invested $1000 in Sherwin-Williams 10 Years Ago, This Is How Much You'd Have Now",20221107T133003,"Why investing for the long run, especially if you buy certain popular stocks, could reap huge rewards.","[{'ticker': 'SHW', 'relevance_score': '0.657331', 'ticker_sentiment_score': '0.316869', 'ticker_sentiment_label': 'Somewhat-Bullish'}]"
Should You Invest in the Materials Select Sector SPDR ETF  ( XLB ) ?,20221108T112006,Sector ETF report for ...,"[{'ticker': 'SHW', 'relevance_score': '0.129516', 'ticker_sentiment_score': '0.070142', 'ticker_sentiment_label': 'Neutral'}]"
"Sherwin-Williams to Acquire German Wood Coatings Companies, Oskar Nolte GmbH and Klumpp Coatings GmbH",20221108T130000,"CLEVELAND, Nov. 8, 2022 /PRNewswire/ -- The Sherwin-Williams Company ( NYSE: SHW ) today announced an agreement to acquire German-based Specialized Industrial Coatings Holding ( SIC Holding ) , a Peter Möhrle Holding and GP Capital UG venture comprised of Oskar Nolte GmbH and Klumpp Coatings ...","[{'ticker': 'SHW', 'relevance_score': '0.460377', 'ticker_sentiment_score': '0.364066', 'ticker_sentiment_label': 'Bullish'}]"
Sherwin-Williams  ( SHW )  Crossed Above the 50-Day Moving Average: What That Means for Investors,20221108T143004,Good things could be on the horizon when a stock surpasses the 50-Day simple moving average. How should investors react?,"[{'ticker': 'SHW', 'relevance_score': '0.863144', 'ticker_sentiment_score': '0.530538', 'ticker_sentiment_label': 'Bullish'}]"
"Antimicrobial Coatings Market to Reach USD 8,650.7 Million by 2027 | Global Antimicrobial Coating Industry Size, Share, and Forecast Report",20221110T070552,"Pune, India, Nov. 10, 2022 ( GLOBE NEWSWIRE ) -- According to Research By Fortune Business Insights™, the global antimicrobial coatings market size is predicted to reach USD 8,650.7 Million by 2027, exhibiting a CAGR of 11.5% during the forecast period.","[{'ticker': 'SHW', 'relevance_score': '0.041755', 'ticker_sentiment_score': '-0.209699', 'ticker_sentiment_label': 'Somewhat-Bearish'}]"
Interview With Quoc Tran of Tran Capital,20221111T184800,Motley Fool analyst John Rotonti recently had the opportunity to discuss stock picking and the broader market environment with Quoc Tran.,"[{'ticker': 'SHW', 'relevance_score': '0.046747', 'ticker_sentiment_score': '0.150936', 'ticker_sentiment_label': 'Somewhat-Bullish'}]"
"Got $5,000? Here Are 3 No-Brainer Dividend Stocks to Buy Right Now",20221113T123500,"A $5,000 investment while these three stocks are down could pay off handsomely in the long run.","[{'ticker': 'SHW', 'relevance_score': '0.035189', 'ticker_sentiment_score': '0.038402', 'ticker_sentiment_label': 'Neutral'}]"
"Home Depot, Lowe's to see higher sales as owners remodel amid rising rates",20221114T160300,Nov 14 ( Reuters ) - Home Depot Inc ( HD.N ) and Lowe's Cos Inc ( LOW.N ) are likely to report rising sales in the third quarter as Americans continue to spend on home improvements in contrast to other retailers facing declining discretionary spending due to surging prices.,"[{'ticker': 'SHW', 'relevance_score': '0.199859', 'ticker_sentiment_score': '0.0', 'ticker_sentiment_label': 'Neutral'}]"
Antifouling Coatings Market Worth USD 3.9 Billion by 2030 Witnessing a CAGR of 4.95% - Report by Market Research Future  ( MRFR ) ,20221115T103000,"New York, USA, Nov. 15, 2022 ( GLOBE NEWSWIRE ) -- Antifouling Coatings Market Overview: According to a Comprehensive Research Report by Market Research Future ( MRFR ) , ""Antifouling Coatings Market Information By Type, By Application, By Region - Forecast till 2030"", the market is estimated ...","[{'ticker': 'SHW', 'relevance_score': '0.033656', 'ticker_sentiment_score': '0.0', 'ticker_sentiment_label': 'Neutral'}]"
HD: 3 Home Improvement Stocks to Buy Now and 2 to Ignore,20221116T202526,"October's Consumer Price Index ( CPI ) and Producer Price Index ( PPI ) rose lower than expected, indicating that inflation is finally cooling. This could bolster the discretionary expenses of households and businesses.","[{'ticker': 'SHW', 'relevance_score': '0.217103', 'ticker_sentiment_score': '0.136749', 'ticker_sentiment_label': 'Neutral'}]"
Lowe's  ( LOW )  Q3 2022 Earnings Call Transcript,20221116T210038,"LOW earnings call for the period ending September 30, 2022.","[{'ticker': 'SHW', 'relevance_score': '0.014082', 'ticker_sentiment_score': '0.153059', 'ticker_sentiment_label': 'Somewhat-Bullish'}]"
Here's How Much You Would Have Made Owning Sherwin-Williams Stock In The Last 20 Years - Sherwin-Williams  ( NYSE:SHW ) ,20221117T143438,"Sherwin-Williams SHW has outperformed the market over the past 20 years by 10.06% on an annualized basis producing an average annual return of 17.58%. Currently, Sherwin-Williams has a market capitalization of $62.43 billion.","[{'ticker': 'SHW', 'relevance_score': '0.983605', 'ticker_sentiment_score': '0.387251', 'ticker_sentiment_label': 'Bullish'}]"
5 Dividend Stocks to Build Your Portfolio Around in 2023,20221121T141500,Beneath every grand house (err... portfolio) is a strong foundation. Build yours this year.,"[{'ticker': 'SHW', 'relevance_score': '0.203386', 'ticker_sentiment_score': '0.271215', 'ticker_sentiment_label': 'Somewhat-Bullish'}]"
Fluoropolymer Coating Market to record USD 553.88 Million growth; Driven by rising population in urban areas - Technavio,20221123T050000,Fluoropolymer Coating Market to record USD 553.88 Million growth. Driven by rising population in urban areas - Technavio PR ...,"[{'ticker': 'SHW', 'relevance_score': '0.03453', 'ticker_sentiment_score': '-0.01139', 'ticker_sentiment_label': 'Neutral'}]"
SHW: 3 Home Improvement Stocks to Spruce up Your Portfolio Now,20221123T210410,"Demand for home improvement products and services increased during the COVID-19 pandemic, with people spending more time in their homes. With people becoming homebound and continuing their hybrid lifestyles, demand remained stable even after the restrictions were eased.","[{'ticker': 'SHW', 'relevance_score': '0.315922', 'ticker_sentiment_score': '0.23701', 'ticker_sentiment_label': 'Somewhat-Bullish'}]"
Sherwin-Williams  ( SHW )  Up 13.2% Since Last Earnings Report: Can It Continue?,20221124T163053,Sherwin-Williams (SHW) reported earnings 30 days ago. What's next for the stock? We take a look at earnings estimates for some clues.,"[{'ticker': 'SHW', 'relevance_score': '0.521465', 'ticker_sentiment_score': '0.272998', 'ticker_sentiment_label': 'Somewhat-Bullish'}]"
Here's How Much You Would Have Made Owning Sherwin-Williams Stock In The Last 10 Years - Sherwin-Williams  ( NYSE:SHW ) ,20221124T190424,"Sherwin-Williams SHW has outperformed the market over the past 10 years by 5.94% on an annualized basis producing an average annual return of 16.96%. Currently, Sherwin-Williams has a market capitalization of $64.78 billion.","[{'ticker': 'SHW', 'relevance_score': '0.983605', 'ticker_sentiment_score': '0.387251', 'ticker_sentiment_label': 'Bullish'}]"
Concrete Floor Coatings Market Size [2022-2029] | Attractive Business Opportunities in Global Concrete Floor Coatings Industry Says Fortune Business Insights™,20221129T111338,"Pune, India, Nov. 29, 2022 ( GLOBE NEWSWIRE ) -- The increasing utilization of CFC in the infrastructure and construction industry is expected to aid the expansion of the market, states Fortune Business Insights, in a report, titled ""Concrete Floor Coatings Market Size, Share, Share, & Industry ...","[{'ticker': 'SHW', 'relevance_score': '0.056943', 'ticker_sentiment_score': '0.236', 'ticker_sentiment_label': 'Somewhat-Bullish'}]"
"Want $1,500 in Passive Income? Invest $10,000 in These 3 Dividend Aristocrats and Wait 5 Years",20221130T110000,This basket of dividend stocks offers a strong yield from quality companies.,"[{'ticker': 'SHW', 'relevance_score': '0.088147', 'ticker_sentiment_score': '0.095982', 'ticker_sentiment_label': 'Neutral'}]"
"HGTV UNVEILS THE HGTV DREAM HOME 2023 IN MORRISON, COLORADO",20221201T150000,"The Winner Will Receive a Prize Package Valued at Over $2.7 Million NEW YORK, Dec. 1, 2022 /PRNewswire/ -- HGTV, a member of the Warner Bros.","[{'ticker': 'SHW', 'relevance_score': '0.039096', 'ticker_sentiment_score': '0.122233', 'ticker_sentiment_label': 'Neutral'}]"
The Corrosion Under Insulation  ( CUI )  & Spray-On Insulation  ( SOI )  Coatings Market Is Set To Grow Due To A Rise In Demand As Per The Business Research Company's CUI & SOI Coatings Global Market Report 2022,20221201T163000,"LONDON, Dec. 01, 2022 ( GLOBE NEWSWIRE ) -- Avail a limited period discount of 33% on our uniquely designed Opportunities and Strategies market research reports. Contact us today and make winning strategies!","[{'ticker': 'SHW', 'relevance_score': '0.030026', 'ticker_sentiment_score': '-0.057313', 'ticker_sentiment_label': 'Neutral'}]"
3Oe Scientific's Iggy™ Named 2022 SEAL Sustainable Innovation Award Winner,20221213T140000,"CARMEL, Ind., Dec. 13, 2022 /PRNewswire/ -- 3Oe Scientific announced today that they were named one of twelve 2022 SEAL Business Sustainability Award winners in the Sustainable Innovations category for their Iggy™ Hand Hygiene system.","[{'ticker': 'SHW', 'relevance_score': '0.091162', 'ticker_sentiment_score': '0.339387', 'ticker_sentiment_label': 'Somewhat-Bullish'}]"
Sherwin-Williams Sees RS Rating Improve To 78,20221214T080000,"Sherwin-Williams ( SHW ) had its Relative Strength ( RS ) Rating upgraded from 63 to 78 Wednesday -- a welcome improvement, but still short of the 80 or better score you prefer to see. X When looking for the best stocks to buy and watch, one factor to watch closely is relative price strength.","[{'ticker': 'SHW', 'relevance_score': '0.878471', 'ticker_sentiment_score': '0.6673', 'ticker_sentiment_label': 'Bullish'}]"
3 Under-the-Radar Growth Stocks to Consider for 2023 and Beyond,20221214T104900,Look beyond the usual suspects for stocks with long-term growth potential.,"[{'ticker': 'SHW', 'relevance_score': '0.159922', 'ticker_sentiment_score': '0.187709', 'ticker_sentiment_label': 'Somewhat-Bullish'}]"
"6.9% CAGR for Floor Coating Market Size Will Surpass $4.26 Bn, Globally, by 2028 - Comprehensive Report by The Insight Partners",20221214T113352,"New York, Dec. 14, 2022 ( GLOBE NEWSWIRE ) -- The Insight Partners published latest research study on Floor Coating Market to 2028 - Global Analysis and Forecast - by Type ( Epoxy, Polyurethane, Acrylics, Polymethyl Methacrylate, and Others ) , Formulation ( Solvent-Based and Water-Based ) , ...","[{'ticker': 'SHW', 'relevance_score': '0.023814', 'ticker_sentiment_score': '0.066419', 'ticker_sentiment_label': 'Neutral'}]"
"REITs, Homebuilders, and the Return of Las Vegas",20221214T180209,"There are a host of shifting story lines in the real estate market now, and some of the plot twists may offer interesting opportunities to investors.","[{'ticker': 'SHW', 'relevance_score': '0.00905', 'ticker_sentiment_score': '-0.006703', 'ticker_sentiment_label': 'Neutral'}]"
"HGTV DREAM HOME 2023 GIVEAWAY IN MORRISON, COLORADO, NOW OPEN FOR ENTRIES",20221223T140000,"The Winner Will Receive a Grand Prize Package Valued at Over $2.7 Million NEW YORK, Dec. 23, 2022 /PRNewswire/ -- Beginning at 9 a.m. ET today, December 23, 2022, through 5 p.m.","[{'ticker': 'SHW', 'relevance_score': '0.046273', 'ticker_sentiment_score': '0.104562', 'ticker_sentiment_label': 'Neutral'}]"
"Global Concrete Densifier Market Anticipated to Garner $1,599.2 Million, Growing with 6.3% CAGR in the 2021-2030 Timeframe [110-Pages] | Announced by Research Dive",20221229T140200,"New York, USA, Dec. 29, 2022 ( GLOBE NEWSWIRE ) -- Research Dive has published a new report on the global concrete densifier market. According to the report, the global market is projected to surpass $1,599.2 million and grow with a CAGR of 6.3% in the estimated period, 2021-2030.","[{'ticker': 'SHW', 'relevance_score': '0.059049', 'ticker_sentiment_score': '-0.100996', 'ticker_sentiment_label': 'Neutral'}]"
Industrial Coatings Market to Hit $183.2 Billion by 2028 | At a CAGR of 4.2%,20230102T112152,"Pune, India, Jan. 02, 2023 ( GLOBE NEWSWIRE ) -- The global industrial coatings market size was USD 132 billion in 2020. The market is projected to grow from USD 137.1 billion in 2021 to USD 183.2 billion in 2028 at a CAGR of 4.2% during the 2021-2028 period.","[{'ticker': 'SHW', 'relevance_score': '0.044718', 'ticker_sentiment_score': '0.0', 'ticker_sentiment_label': 'Neutral'}]"
Automotive Specialty Coatings Market is expected to grow from USD 8.25 billion in 2022 to USD 14.93 billion by 2030 : GreyViews,20230102T130000,"Pune India, Jan. 02, 2023 ( GLOBE NEWSWIRE ) -- The market has been studied for the below mentioned-segmentation and regional analysis for North America, Europe, Asia, South America, and Middle East and Africa.","[{'ticker': 'SHW', 'relevance_score': '0.024904', 'ticker_sentiment_score': '0.09633', 'ticker_sentiment_label': 'Neutral'}]"
Should You Invest in the Vanguard Materials ETF  ( VAW ) ?,20230103T112006,Sector ETF report for VAW ...,"[{'ticker': 'SHW', 'relevance_score': '0.136499', 'ticker_sentiment_score': '0.072027', 'ticker_sentiment_label': 'Neutral'}]"
"Wall Street's Most Accurate Analysts Reshuffled Their Best Materials Picks, Here They Are - Air Products & Chemicals  ( NYSE:APD ) , BHP Group  ( NYSE:BHP ) ",20230105T113435,"US stocks closed higher on Wednesday following the release of minutes from the Fed meeting. Materials stocks were among the top performers, gaining around 1.7% during the session. Wall Street analysts make new stock picks on a daily basis.","[{'ticker': 'SHW', 'relevance_score': '0.070517', 'ticker_sentiment_score': '0.0', 'ticker_sentiment_label': 'Neutral'}]"
RPM International  ( RPM )  Matches Q2 Earnings Estimates,20230105T130504,"RPM International (RPM) delivered earnings and revenue surprises of 0% and 0.88%, respectively, for the quarter ended November 2022. Do the numbers hold clues to what lies ahead for the stock?","[{'ticker': 'SHW', 'relevance_score': '0.209365', 'ticker_sentiment_score': '0.0', 'ticker_sentiment_label': 'Neutral'}]"
3 Soon-To-Be Dividend Kings,20230106T193500,"While Dividend Aristocrats are impressive, Dividend Kings are a step above. And these three companies are already knocking on the door of the elite club, just a few years away from joining.","[{'ticker': 'SHW', 'relevance_score': '0.327366', 'ticker_sentiment_score': '0.299495', 'ticker_sentiment_label': 'Somewhat-Bullish'}]"
"Zacks Investment Ideas feature highlights: Archer Daniels Midland, Sherwin-Williams and Aflac",20230109T135300,"Archer Daniels Midland, Sherwin-Williams and Aflac have been highlighted in this Investment Ideas article.","[{'ticker': 'SHW', 'relevance_score': '0.33446', 'ticker_sentiment_score': '0.310745', 'ticker_sentiment_label': 'Somewhat-Bullish'}]"
Corrosion Protection Coatings and Acid Proof Lining Market will value USD 18.9 billion by 2030 : GreyViews,20230109T190000,"Pune India, Jan. 09, 2023 ( GLOBE NEWSWIRE ) -- The market has been studied for the below mentioned-segmentation and regional analysis for North America, Europe, Asia, South America, and the Middle East and Africa.","[{'ticker': 'SHW', 'relevance_score': '0.023191', 'ticker_sentiment_score': '0.061399', 'ticker_sentiment_label': 'Neutral'}]"
Should You Invest in the Materials Select Sector SPDR ETF  ( XLB ) ?,20230110T112007,Sector ETF report for ...,"[{'ticker': 'SHW', 'relevance_score': '0.131284', 'ticker_sentiment_score': '0.070609', 'ticker_sentiment_label': 'Neutral'}]"
"Global Leisure Boat Marine Coating Market Expected to Grow at 7.3% CAGR and Garner $3,947.9 Million in the 2022-2031 Timeframe [245-Pages] | Issued by Research Dive",20230111T140100,"New York, USA, Jan. 11, 2023 ( GLOBE NEWSWIRE ) -- According to the newly published Research Dive report, the global leisure boat marine coating market is anticipated to rise at a stable CAGR of 7.3%, thereby garnering a revenue of $3,947.9 million in the 2022-2031 timeframe.","[{'ticker': 'SHW', 'relevance_score': '0.05339', 'ticker_sentiment_score': '0.0', 'ticker_sentiment_label': 'Neutral'}]"
"Sherwin-Williams  ( SHW )  Gains on Higher Demand, Expansion Moves",20230111T142600,"Sherwin-Williams (SHW) benefits from higher demand in architectural and industrial end markets, pricing actions and expansion of retail operations.","[{'ticker': 'SHW', 'relevance_score': '0.404563', 'ticker_sentiment_score': '0.340781', 'ticker_sentiment_label': 'Somewhat-Bullish'}]"
Stories we're watching in 2023,20230113T112017,Stories we're watching in ...,"[{'ticker': 'SHW', 'relevance_score': '0.067823', 'ticker_sentiment_score': '0.0', 'ticker_sentiment_label': 'Neutral'}]"
This Favorable Sign Appears On Sherwin-Williams's Chart,20230118T144840,"If history is any guide, there may be good fortune ahead for shares of Sherwin-Williams SHW. A so-called ""golden cross"" has formed on its chart and, not surprisingly, this could be bullish for the stock. What To Know: Many traders use moving average crossover systems to make their decisions.","[{'ticker': 'SHW', 'relevance_score': '0.567144', 'ticker_sentiment_score': '0.561872', 'ticker_sentiment_label': 'Bullish'}]"
Here's Why You Should Hold Onto Sherwin-Williams for Now,20230119T132900,Sherwin-Williams (SHW) gains on favorable demand in North America and its pricing and expansion actions amid challenges from higher raw material costs and demand slowdown in Europe and China.,"[{'ticker': 'SHW', 'relevance_score': '0.320974', 'ticker_sentiment_score': '0.152882', 'ticker_sentiment_label': 'Somewhat-Bullish'}]"
Sherwin-Williams  ( SHW )  Reports Next Week: Wall Street Expects Earnings Growth,20230119T150050,Sherwin-Williams (SHW) doesn't possess the right combination of the two key ingredients for a likely earnings beat in its upcoming report. Get prepared with the key expectations.,"[{'ticker': 'SHW', 'relevance_score': '0.300088', 'ticker_sentiment_score': '0.059885', 'ticker_sentiment_label': 'Neutral'}]"
"Aerospace Coatings Market is expected to generate a revenue of USD 2.62 Billion by 2028, Globally, at 6.49% CAGR: Verified Market Research®",20230120T133000,Aerospace Coatings Market is expected to generate a revenue of ... PR ...,"[{'ticker': 'SHW', 'relevance_score': '0.041039', 'ticker_sentiment_score': '0.058119', 'ticker_sentiment_label': 'Neutral'}]"
Decorative Paints Market will achieve USD 82.1 billion by 2030 : GreyViews,20230120T180000,"Pune India, Jan. 20, 2023 ( GLOBE NEWSWIRE ) -- The market has been studied for the below mentioned-segmentation and regional analysis for North America, Europe, Asia, South America, and the Middle East and Africa. These are the key regions where the decorative paints market is operating and is ...","[{'ticker': 'SHW', 'relevance_score': '0.028524', 'ticker_sentiment_score': '0.112533', 'ticker_sentiment_label': 'Neutral'}]"
Sherwin-Williams: Debt Overview,20230120T191222,"Shares of Sherwin-Williams Inc. SHW increased by 8.48% in the past three months. Before having a look at the importance of debt, let's look at how much debt Sherwin-Williams has.","[{'ticker': 'SHW', 'relevance_score': '0.3007', 'ticker_sentiment_score': '0.113961', 'ticker_sentiment_label': 'Neutral'}]"
Did the economy end 2022 with a bang or a whimper? | Business,20230122T121600,Did the economy end 2022 with a bang or a whimper? CNN International ...,"[{'ticker': 'SHW', 'relevance_score': '0.059935', 'ticker_sentiment_score': '-0.085039', 'ticker_sentiment_label': 'Neutral'}]"
Did the economy end 2022 with a bang or a whimper? | Business,20230122T121600,Did the economy end 2022 with a bang or a whimper? ...,"[{'ticker': 'SHW', 'relevance_score': '0.059935', 'ticker_sentiment_score': '-0.085039', 'ticker_sentiment_label': 'Neutral'}]"
"Tesla, Microsoft, Boeing earnings, along with GDP top week ahead",20230122T222233,"This week will be a busy one for investors with earnings from defense, credit cards and airline companies all reporting quarterly results. The stock market is coming off a mixed week with the Dow Jones Industrial Average falling over 2%, while the S&P slipped marginally as the Nasdaq Composite ...","[{'ticker': 'SHW', 'relevance_score': '0.05654', 'ticker_sentiment_score': '0.0', 'ticker_sentiment_label': 'Neutral'}]"
